text,highlighted
"From time to time, we offer our customers promotional offers with select retailers which you can choose to participate in if you wish.",0
We call this curve rewards.,0
Our curve rewards supplemental terms are here.,0
The terms specific to individual offers will be presented to you at the time you select the offer.,0
"Provided that you comply with the terms of the offers you choose to take part in, we will pay to your curve cash card an amount in accordance with those offers",0
The funds paid by us to your curve cash card for any curve rewards offers will be held as e-money and safeguarded as required by lithuanian law.,0
These funds are available for you to spend when you select the curve cash card as a funding source for your curve card.,0
Please note that you cannot use your curve cash card to withdraw cash and it cannot be used by you to pay any fees to curve.,0
"If you want to withdraw funds from your curve cash card, you can get in touch with us.",0
Curve cash,0
Sometimes we offer our customers cashback in the form of points for using their curve account and card we call this curve cash.,0
You can check out the current curve cash terms .,0
On our website.,0
We change this every now and then but you can keep a tab on this through our website.,0
Curve cash is different to curve rewards.,0
"With curve cash, you ll receive curve cash points, which we add to your curve cash card.",0
"However, curve cash points have no cash value and are not deemed to be e-money or any other equivalent of a fiat currency (unlike curve rewards).",0
Your curve cash points cannot be used to withdraw cash or otherwise be redeemed for cash.,0
You cannot use curve cash points to pay for any fees due to curve.,0
"When you use your curve cash card for a transaction, curve will convert your curve cash points to e-money (our little gift to you!)",0
To the value of the transaction.,0
You will still be charged any fees that may be applicable to a transaction when these points are used.,0
"If there are not enough curve cash points on your curve cash card, the transaction will be declined.",0
"Please note that if your curve cash card holds curve cash points in addition to other funds (for example, from curve rewards) then those other funds will be used first and your curve cash points will only be converted to e-money and used when there are no other or insufficient other funds to complete a transaction.",0
Curve cash points expire 6 months from the date they are added to your curve cash card.,0
"If your account is closed either by you or by curve, you will not be able to redeem the value of your curve cash points.",0
Using the curve app to access accounts with other service providers,0
You can also access your accounts with other service providers and initiate payments from those accounts.,0
We call these account information service (ais) and payment initiation service (pis).,0
"When you use our ais to view information about an account you hold with another provider, or use our pis to initiate a payment from an account you hold with another provider to initiate a transaction, you must authorise us to access that account and/ or make a payment.",0
We won t store any of the sensitive payment data you provide to give that authorisation.,0
We will consider that you gave us consent and authorised us to initiate payments or view information from those accounts when you choose in your curve app the certain service and filled in requested information.,0
Open banking permissions,0
We may provide you access through the curve app to a third party ais and pis provider - to check whether this service is available in your country - please check here.,0
These services will allow you to obtain financial information from your online bank or third party payment account (account information services) and to make online payments directly from your third party payment account (payment initiation services).,0
You will need to sign up to the third party ais and pis provider s terms and conditions during the sign up process and provide them your details in order to create an account on their system and to access your data or execute payments.,0
"We have no responsibility for the products and services provided to you by or through the ais and pis third party provider and will not be liable to you for any harm, damage or loss arising from your use of the products and services provided to you by or through the third party ais and pis provider",0
The terms and conditions that are connected to your third party payment account apply to the payment accounts that you access through the third party ais and pis provider will remain in effect and are not amended by these terms and conditions,0
Curve is not responsible for the information that you receive from the third party payment account provider or third party ais and pis provider,0
Closing &amp.,0
Suspending accounts,0
"When can we block, suspend or close your account?",0
Blocking.,0
"We ll block your account if we have reasonable concerns about your account s security or suspect fraud, money laundering or where law or regulation requires us to.",0
Suspension and closure.,0
We may immediately suspend or close your account for a number of reasons including where:,0
"You use curve in a way that these terms don t allow,",0
"You don t provide us information we ve asked for or information you ve provided is false or misleading,",0
"We determine you have breached our fair use policy,",0
Your behaviour towards us makes it difficult to deal with you (e.g.,0
"You insult our staff),",0
"You ve broken these terms in a serious or persistent way and you haven t put the matter right within a reasonable time of us asking you to,",0
"We re required to by law or regulation,",0
"You re declared bankrupt,",0
We can verify that you have died.,0
"We ll give you at least 2 months notice if we want to close your account for any other reason, unless we are prohibited by law from doing so.",0
How can you close your account?,0
By accepting these terms you agree that curve will start implementing them before the end of the 14 days cooling off period.,0
You can cancel your account at any time by emailing us at support@curve.com or contacting us in the app.,0
You ll get a refund of any subscription fees you ve paid if you change your mind within the first 14 days of signing up (the cooling off period).,0
You will be charged pro rata if you have used any of the curve services (including receiving a card).,0
"If you re a curve metal customer, you ll need to give us 1 months notice before you can close your account.",0
If you cancel or downgrade your curve metal account in the first six months after subscription - you will also be charged a curve metal card fee to cover the cost of ordering and delivering the metal card.,0
If you cancel after the first six months have elapsed - this cost is on us.,0
"On closing your account, you still need to pay us any fees you owe us or any transactions that have not yet completed.",0
You ll also need to make sure you cancel any outgoing payments you don t want to pay anymore.,0
"If there is a balance on your curve account, this will be redeemed to an underlying card s bank account - once we complete our checks (if needed).",0
"If any balance is still remaining on your account when your account is closed you can request to have these funds returned to a bank account in your name, subject to our checks.",0
You forfeit your rights on these funds if you do not claim these funds within 6 years from the date your account was closed.,0
During this period your funds will be kept safe,0
Complaints,0
How can you make a complaint?,0
"We hope you don t ever need to but if you do ever want to complain, you can contact us at support@curve.com or complaints@curve.com or via the curve app.",1
We ll try and fix your problem as soon as we can.,0
"Our final response to your complaint, or a letter explaining why the final response has not been completed, will be provided to you within 15 business days after your complaint has been made, and in exceptional circumstances, within 35 business days (and we will let you know if this is the case).",0
"Just so you know, our complaints management and customer service is currently only available in english.",0
If you are a natural person and a consumer and in case you re still not happy with our response you can refer your complaint to the bank of lithuania which is an out of court dispute resolution authority dealing with disputes between consumers and financial service providers.,0
"Please note that should you wish to have a possibility to apply to the bank of lithuania as to the out of court dispute resolution authority, then you shall make your complaint to us within 3 (three) months from the day that you found out or should have found out about the alleged violation of your rights or legitimate interests arising from agreement with us.",0
"Additionally, take into account that you can apply to the bank of lithuania within 1 (one) year of the date you sent us your complaint.",0
You can contact the bank of lithuania by the following ways:,0
"By submitting the complaint through the electronic dispute resolution tool ""electronic government gateway""",0
"By filling in the consumer s application form and sending it to the supervision service of the bank of lithuania, algirio str.",0
"90, 09303 vilnius, e-mail pt@lb.lt or to totori str.",0
"4, 01121 vilnius, e-mail info@lb.lt",0
"By submitting a free-form application and sending it to the supervision service of the bank of lithuania, algirio str.",0
"90, 09303 vilnius, e-mail pt@lb.lt or to totori str.",0
"4, 01121 vilnius, e-mail info@lb.lt.",0
Examination of the complaint at the bank of lithuania is free of charge.,0
You can find the consumer application form and more information on their website.,0
You can get more details about how we handle complaints in our faqs.,0
You may also use the online dispute resolution service if you are an eu resident and have a complaint about our services.,0
The website is: http://ec.europa.eu/consumers/odr.,0
"As the odr service will ultimately redirect your complaint to the bank of lithuania, you may prefer to contact us or the bank of lithuania directly in the first instance.",0
Other important legal stuff,0
Our liability,0
We are liable for proper execution of your payment transactions.,0
We ll not be responsible for any money you ve lost as a result of:,0
"A merchant or atm provider refusing to accept your curve card,",0
"Us suspending or closing your account in accordance with these terms,",0
"Curve implementing a legal or regulatory requirement,",0
"Unforeseeable events outside our control, where the consequences would have been unavoidable despite our best efforts,",0
"Goods or services that you purchase using your curve card,",0
"Loss or corruption of data unless caused by our wilful wrongdoing,",0
Our compliance with applicable laws.,0
"We re also not responsible for any charges you have to pay to third parties, like your payment card issuers or payment account service providers, for using the curve account and services.",0
"If we breach our terms with you, we ll only be responsible for losses that could have been foreseen at the time we entered into these terms and are directly related to the event in question.",0
We ll do all we reasonably can to make sure that our services are not interrupted and are accessible at a reasonable speed.,0
"However, we can t promise that this will always be the case e.g.",0
Where we rely on third parties to process payments.,0
"Nothing in these terms will stop us being responsible to you, if we act fraudulently, we act with a very significant degree of carelessness, or we re at fault and the law does not allow us to exclude or limit our liability.",0
"We will not be liable to you in respect of any losses you or any third party may suffer in connection with the use of curve s service - app, account or curve card as a result of our actions which were not a foreseeable consequence of our actions.",0
Changes to these terms,0
"Because these terms will continue till you or we end them, we may need to change these terms every now and then.",0
"If we make changes that are clearly in your favour, we ll tell you once we ve made them.",0
"Otherwise, we ll give you 2 months notice before the change will come into effect - so you can easily end these terms if you don t agree with the changes.",1
Any such changes will only of course be made if they are reasonable.,0
We ll assume you re happy with the change unless you tell us otherwise.,1
We may amend these terms to reflect changes:,0
"To the law or regulatory requirements,",0
"To the way we manage your curve account as a result of changes in technology and changes to the curve system that we use,",0
"In the cost of providing your account and other curve services,",0
"To our existing products and services,",0
And anything else that we currently can t predict.,0
We ll assume you re happy with the changes unless you tell us otherwise,0
We may not be able to give you 2 months notice before changes take effect if they are due to reasons outside our control.,0
"If so, you will always have 2 months from when they take effect to cancel your account free of charge.",0
Our contract with you,0
Personal to you.,0
Only you and we have any rights under these terms.,0
These terms are personal to you and you can t transfer any rights or obligations under them to anyone else.,0
Transfer.,0
We can transfer any of our rights and obligations under the terms to comply with a legal or regulatory requirement and we reasonably think that a transfer would not have a significantly negative effect on your rights.,0
Severability.,0
"If for any reason a part of these terms becomes invalid or unenforceable, we both agree that the invalid or unenforceable parts can be removed and that the rest of the terms will still be enforceable.",0
Waiver.,0
"If you fail to keep to any of your obligations and we don t take action against you (immediately or ever), we can still take action at a later date.",0
Our intellectual property,0
"Curve owns all the intellectual property in the curve products and services or has a license to use them, e.g.",0
"Curve app, curve website, curve logo and card designs.",0
"You agree you won't use curve's intellectual property, except to use curve s products.",0
"Also, you agree you won t reverse engineer any of curve s products (that is try to reproduce them after a detailed examination of their composition).",0
Lithuania law applies,0
"Lithuania law will decide any legal questions about this agreement, and about our dealings with you with a view to entering into it.",0
"If you are living in another eea country when this agreement starts, lithuania law will still apply, but will not act to deprive you of any mandatory protections that would have been afforded to you in that country.",0
"In addition, the competent authorities of that country will have jurisdiction to hear any claims in relation to this agreement, but you can still bring a claim against us in the competent authorities of lithuania if you want to.",0
Your data,0
"By agreeing these terms, you also agree to us using your information to make and receive payments on your account, and any other lawful grounds that curve has to use your information.",0
"If you re no longer happy for us to use your information, we ll have to close your account.",0
We may keep your personal data and use it where we have lawful grounds to do so.,0
"For example, any identity verification information we need to maintain for regulatory reasons (please refer to our privacy policy).fees schedulesubscription feeto provide you with the benefits and services associated with your curve cardmetal 14.99 per month or 150 per yearblack 9.99 per monthblue 0",0
Delivery feeto cover the cost of delivering a physical card (when issued only a digital card)metal 0black 0blue 5,0
Replacement card feeto provide you with a replacement curve cardmetal 50blackfirst replacement is free.,0
5 for each subsequent replacementblue 5,0
"Cancellation fee if you cancel your curve card during the 14 day cooling-off periodto cover the cost of providing your curve card, including the cost of making it and posting it to you and providing you with the benefits associated with your card up to the point you cancel it (applied only if you have been issued with a physical black or metal card).metal 50black 8blue 0cancellation fee after the 14 day cooling off periodto cover the cost of providing your curve card, including the cost of making it and posting it to you and providing you with the benefits associated with your card up to the point you cancel it.metal 50 if you cancel during the first 6 months and ordered a physical cardblack 0blue 0cash withdrawal feeto cover the cost of enabling you to withdraw cash from atms.",0
Note: some atm providers may impose additional charges.,0
First 10 withdrawals are free.,0
Thereafter 0.50 per withdrawal.,0
Currency conversion fee - for purchases you make monday-to friday (excluding bank holidays)to cover enabling you to pay for goods and services in a currency different from the currency of your payment card.,0
Any fee we charge will be in addition to the exchange rate we use to convert the currency you used to pay for the goods and services to the currency your payment card is in.,0
"We ll use our standard exchange rate for purchases and cash withdrawals you make when the foreign currency markets are open in the uk (typically monday-friday, excluding bank holidays).metalunlimited fee free currency conversion (subject to a fair use up to 60,000 a year).",0
"Thereafter, we will charge a currency conversion fee of 2% of the transaction amount over the standard exchange rate.blackunlimited fee free currency conversion (subject to a fair use up to 15,000 a year).",0
"Thereafter, we will charge a currency conversion fee of the greater of 2% over the standard exchange rate.bluefee free currency conversion up to up to 500 per rolling 30-day period.",0
"Thereafter, we will charge a currency conversion fee of the greater of 2% over the standard exchange rate.",0
Currency conversion fee - for atm withdrawals you make monday-to friday (excluding uk bank holidays)to cover enabling you to withdraw cash from an atm in a currency different from the currency of your payment card.,0
We ll use our standard exchange rate described above.metalfee free currency conversion up to 600 per rolling 30 day period.,0
Year.,0
"Thereafter, we will charge a currency conversion fee of 2% or 2 (whichever is higher) of the transaction amount over the standard exchange rateblackfee free currency conversion up to up to 400 per rolling 30-day period.",0
"Thereafter, we will charge a currency conversion fee of the greater of 2% or 2 over the standard exchange ratebluefee free currency conversion up to up to 200 per rolling 30-day period.",0
"Thereafter, we will charge a currency conversion fee of the greater of 2% or 2 over the standard exchange rate.",0
Currency conversion fee - for purchases and atm withdrawals you make over the weekend or uk bank holidaysto cover the cost of enabling you to make purchases and withdraw cash in a currency different from the currency of your payment card.,0
We ll use the weekend exchange rate for purchases and cash withdrawals you make when the foreign currency markets are closed in the uk (typically weekends and bank holidays).,0
The weekend rate is the rate at the time the markets closed.,0
"In case of withdrawals or purchases over the weekend where the currency of the selected payment card is different to the currency of the spend, as the forex markets are closed, we take the rate of last days the market were open (in most cases friday :23:59 gmt) and apply a surcharge.",0
"If there is a currency conversion and the currency of the selected payment card and the currency of the transaction are both in one of gbp, usd or eur, the rate will be increased by 0.5%.",0
"In any other case, that is if either the currency of your transaction or the currency of the selected payment card is any of our other supported currencies, the rate will be increased by up to 1.5%.",0
Curve fronted feeto cover the cost of enabling you to use a credit card as your payment card to pay merchants who only accept payment by debit card or who impose a charge or deny certain cards.,0
Please note that your credit card issuer may also charge fees.metalno feesblack1.5% of the total transaction amount.blue1.5% of the total transaction amount.,0
Credit card withdrawal fee (limits and fees)charges for using your credit card as the selected payment card when making cash withdrawals.,0
Where your selected payment card is a credit card: free up to 200 per calendar month.,0
Thereafter 2% of the withdrawal amount .,0
"Please note that this is not a limit per credit card, but a cumulative for all credit card withdrawals using your curve card in a calendar month",0
This fee will be in addition to any of the other fees mentioned above.,0
Note: our platform uses third-party systems to identify whether the payment card is a credit card.,0
If you believe your card has been incorrectly defined you should contact us and we may ask you for information so we can investigate.,0
"When fees are only stated in eur, and you are a customer resident in any other eea countries, you will be charged in your local currency equivalent which is calculated in the same way as the currency conversion discussed above.",0
Annex 1,0
Definitions,0
"Business day a calendar day, except saturdays, sundays and official holidays and days off set by the legal acts of the republic of lithuania, when banks are normally open for business in lithuania unless set by curve and notified to you as the client of curve differently.",0
"Curve curve europe uab, a legal entity registered in lithuania with its registration number 305626541, registration address jogailos str.",0
"9, vilnius, lithuania.",0
Data on the company is accumulated and stored in the register of legal entities of the republic of lithuania.,0
Curve has an electronic money institution license no.,0
"73 issued by the bank of lithuania on 22nd of october, 2020.",0
"Curve as an electronic money institution is supervised by the bank of lithuania, located at gedimino pr.",0
"6, lt-01103, vilnius, lithuania, telephone no.",0
+370 800 50 500.,0
More information about the bank of lithuania is detailed by this link https://www.lb.lt/en/,0
Curve account or curve e-money account an account assigned to store e -money.,0
This account is linked to your curve card and executes transactions and contains information performed by you.,0
Curve card a payment card issued by curve that might be either a personal or business curve card.,0
Curve card might be a physical and / or digital card,0
E-money electronically stored monetary value as represented by a claim on curve which is issued on receipt of funds for the purpose of making transactions.,0
"Fees schedule a list of fees and charges curve applies for and in connection with the use of the services, as may be amended by curve from time to time, which is published on curve s website.",0
Fees schedule forms an integral part of the terms,0
"Payment card any debit card, credit card or prepaid card that is linked to the curve account",0
"Privacy policy curve s policy governing the processing of personal data, which is published on the website and placed in curve s app.",0
"By accepting these terms, you also accept and agree to the provisions of the privacy policy, as amended from time to time.",0
"Transaction a money placement, collection, transfer or withdrawal initiated by you as a client of curve.",0
"Terms these terms of service, any references to the curve s website provided in these terms of service and its annexes, if any.",0
Website curve s website www.curve.com where you can always find the terms and other policies applicable to you.,0
Version history,0
Version - 01 jan 2021,0
Version - 01 jan 2021,0
