text,highlighted
Eea terms of service,0
Version: 1.2 -,0
08 july 2021,1
If you are a samsung pay+ user the terms of service that apply to you are here.,0
"If you are resident in the uk, the terms of service that apply to you are .",0
Here,1
General information,0
Who are we?,0
Hello.,0
"We re curve europe uab, registered in the republic of lithuania with company number 305626541, but you ll know us better as curve.",0
"In case you want to send us a letter, we are based at jogailos g.",0
"9, lt-01116 vilnius.",0
"If you have any questions about these terms and conditions (terms) or anything at all, just drop our friendly customer support team a line at support@curve.com or get in touch via the curve app.",0
"If we need to contact you, we ll contact you in english via the curve app, by email, phone or using your home address - depending on the information we need to share - so make sure your details are always up to date.",0
"If in doubt, these terms are concluded in english.",0
What are these terms?,0
These terms set out the terms of service for your curve account and other important things you need to know.,0
"By clicking accept/continue you re entering into a legally binding agreement with curve europe uab, which issues your curve card and electronic money (e-money)",0
Curve is authorised to issue e-money by the bank of lithuania (located at gedimino ave.,0
"6, lt-01103, vilnius, lithuania, telephone no.",0
+370 800 50 500.,0
More information about the bank of lithuania is detailed by this link https://www.lb.lt/en/) (licence no.,0
73 issued on 22 october 2020),0
These terms are always available on our website and,0
"If we make any changes to these terms, we'll always let you know about it via email.",1
Anything else you should read?,0
The fee schedule forms part of these terms and we highly recommend reading it.,0
"Along with these terms, you should take a look at our privacy policy, cookie policy, fair use policy, curve customer protection policy and refer to the faqs for any questions you may have.",0
Definitions used in these terms are provided in annex no 1.,0
Please read these terms carefully and contact us at support@curve.com or get in touch via the curve app if you have any questions,0
Who can open a curve account?,0
You can open a curve account:,0
"If you re a resident in one of the eligible countries listed in the app or on our website,",0
"Have the full legal capacity to enter into a contract, and",0
You re 18 years old or over.,1
You can t open a curve account:,0
"On someone else s behalf, or",0
"If you already have a curve account, or",0
If there is any reason that curve is unable to grant you an account under the law that applies to us.,0
"When you open your account, we ask you for information which is required to open the account",0
"If this information is not provided, your account opening will be delayed",0
"We may ask you for additional information, from time to time, in addition to what you provided when you opened your account and if this information is not provided to meet our requirements this may result in your account being suspended or closed.",0
What should you know about your curve account?,0
E-money.,0
"Your curve account stores e-money, an electronic alternative to cash that can be used to pay for goods and services, in store or online and to take money out at an atm.",0
Rest assured that your money is always kept separate from our own.,0
This is known as customer funds safeguarding.,0
It is required by law and ensures that your money is protected and returned to you in full if we decide to cease operations or become insolvent.,0
No interest.,0
We re not allowed to pay you interest on the funds we hold for you and they are not protected by the deposit insurance fund.,0
"Don t worry: curve is required to keep your funds safe in a safeguarding bank account, which means that all of your funds are protected.",0
How it works.,0
"You need to link and verify an eligible payment card to your curve account in the curve app, before you can use your curve card.",0
"The payment card can be any debit card, credit card or prepaid card that we allow you to link to your curve account.",0
"We may need to introduce certain restrictions on the cards that we are able to accept on to the curve system and will try to keep you informed on any changes, some of which may depend on the card schemes.",0
"When you make a transaction using your curve card, curve (with your permission) loads funds from your selected payment card to curve.",0
This is done for you automatically by the curve processing system (no hassle to you).,0
"The amount loaded will be the value of the transaction, plus any fees for that transaction (including for any curve services provided).",0
The loaded funds are used to issue e-money which is loaded onto your curve e-money account and are then used to pay for the transaction made with your curve card.,0
"If your selected payment card account has insufficient funds or declines the transaction for any other reason, the transaction will be declined.",0
"In case curve receives a decline from the payment card selected in the curve app, we may try to process the transaction from the cards that you have set as your default or back up cards (for more information on how to set this up, go here)",0
You can add multiple payment cards to the curve app and change the selected payment card at any time using the curve app.,0
Each time you link a payment card to your curve account you re giving us a continuous authority to use that payment card to fund the purchase of the e-money used to pay for transactions.,0
Curve will use various means to identify that the card you have added to your account is yours and that you have the right to use it.,0
You can see your transactions on the timeline in the curve app.,0
What should you know about your curve card?,0
"Curve will issue you either a personal or business curve card, based on the purpose of the card use you selected during the sign-up process.",0
It will either be a physical and/or digital card.,0
"A digital card is a card where you can see your curve card details in the curve app only, and can request a physical card if you want one (fees for this are in the fee schedule).",0
"You can use your curve card to make purchases for goods and services, in store or online.",0
"To withdraw cash, you will .",0
Need a physical curve card.,0
Please note that you cannot withdraw cash at an atm if you have your curve cash card selected as a funding source for the curve card.,0
Accounts &amp.,0
Security,0
What type of accounts can you open?,0
Personal or business.,0
Curve offers both,0
Personal and .,0
Business accounts.,0
You can only open a business account if you are a sole-trader or a self-employed natural person and intend to use your curve account exclusively for business spend.,0
You cannot open a business account for a company or partnership,0
We can suspend your account or change it from business to personal if we reasonably think it is not being used for business purposes.,0
"If we change your account type, we will issue you with a replacement card.",0
"From time to time, we may request further information from you, to verify your business status and business spend.",0
Please note that the use of a curve business account for personal spend is not permitted under these terms,0
"If you have a business account but wish to use curve for personal reasons, you must contact us to change your account type.",0
There is no cost to you for this change.,0
Accounts.,0
We offer accounts with different levels of services and fees:,0
Account type benefits subscription fees,0
Curve blue,0
Curve blue benefits,0
Subscription fees: none check out the fee schedule for full details.,0
Curve black,0
Curve black benefits,0
Subscription fees: eur 9.99 monthly - check out the fee schedule for full details.,0
Curve metal,0
Curve metal benefits,0
Subscription fees: eur 14.99 monthly or eur 150 annually - check out the fee schedule for full details.curve black legacy (for curve black customer who signed up before 28 jan 2019 and elected to stay on)curve black legacy benefits,0
Subscription fees: no subscription fees.,0
"For all other fees, check under the curve black section of the fee schedule",0
Minimum subscription periods,0
"When you subscribe to curve black or metal, you can choose to pay monthly or annually.",0
"Depending on which you choose, minimum subscription periods apply.",0
"If you choose to pay monthly, the minimum subscription period is 6 months.",0
If you wish to cancel your subscription you may do so but you will not be refunded any amount paid for the current month of the subscription.,0
"If you cancel your subscription and it is less than 4 months since the start of it, you must give us 2 months advance notice (such notice period to run from the end of your current subscription month).",0
You do not need to give us advance notice if you want to cancel and it is more than 4 months since the start of it.,0
"If you choose to pay annually, the minimum subscription period is 12 months.",0
This minimum subscription period will apply each time your subscription is renewed.,0
If you wish to cancel your subscription you may do so but you will not be refunded any amount of the annual subscription fee.,0
You do not need to give us advance notice to cancel your subscription,0
"In all cases where your subscription is subject to a minimum subscription period (whether 6 months because you pay monthly or 12 months because you pay annually), you will continue to have all of the benefits available under those subscriptions until the end of the period for which you have paid.",0
"For example, if you cancel your 12 month subscription during its second month, you can continue to use the benefits under the subscription for the remaining 10 months.",0
If you were .,0
"An existing curve black or metal subscriber at the time version 1.2 of these terms was published (29 april 2021), the minimum subscription periods detailed above will not apply to you for so long as you continue on your current subscription (this includes annual subscribers when their subscription renews).",0
"If you upgrade from black to metal or downgrade from metal to black or change your subscription payment schedule from monthly to annually or annually to monthly, the minimum subscription periods will apply.",0
More than one account.,0
You can not hold more than one curve account.,0
We can close down additional accounts without informing you first.,0
Upgrading your account.,0
You can upgrade your account simply by clicking on the manage your subscription tab in the app.,0
You can also change the payment card your subscription is charged to using the same tab.,0
"If we can t charge your nominated payment card for subscription fees or any other fees you owe us - e.g., if your card has expired or has insufficient funds - you agree that we can take them from any other payment card you ve linked to your curve account.",0
"If we can t take the fees from any of the other payment cards either, you ll need to provide us with a valid payment card within 30 days of our request to do so, otherwise we may either close or downgrade your account.",0
Downgrading your account.,0
You can downgrade your account by getting in touch with us and fees may be payable in accordance with the fee schedule.,0
"Curve reserves the right to restrict the ability to subscribe to the curve metal or curve black account for customers who upgrade or downgrade from another type of account, more than once in a given 12 month period.",0
Fees.,0
You can find details of the fees we charge in the fee schedule.,0
We will keep you informed before we introduce any new fee or make changes to any existing fees.,0
Replacement card.,0
We charge fees for replacing your curve card at the time we process the request for a replacement card.,0
We can charge the fee from any of the payment cards linked to your curve account.,0
We won t charge you to replace a card that has been stolen or misappropriated.,0
Curve fronted,0
"Using your curve card (with a debit or credit card as your payment card) to pay merchants who only accept payments by debit card, or who either impose a charge or deny certain types of credit cards (e.g.",0
"Paying off a credit card with an underlying credit card selected), is defined by curve as a curve fronted transaction and will attract a service fee (see our fees schedule for details).",0
Please note that before you start using this function you should make sure that your underlying credit card issuer allows usage of your credit card to fund curve card transactions.,0
Please remember that when you fund your curve card with a credit card or other card that applies fees to transactions:,0
Your underlying credit card issuer may also apply fees in relation to curve fronted transactions using curve.,0
Curve will not be liable for such fees.,0
"These fees are strictly non-refundable in nature,",0
"You may have to pay other costs, taxes or charges which are outside our control and not charged by us e.g.",0
Your payment card issuer may charge you for making a payment through your curve card.,0
Keeping your account safe,0
"Please keep your curve card, account information, security details and the devices you use to access your account safe.",1
This means:,0
"Signing your curve card as soon as you receive it (if you can),",0
"Not sharing your security details with anyone (including your curve card pin, curve app password or pin or other security information used to protect your curve account),",0
"Not letting anyone else use your curve card or curve app,",0
"Keeping your curve card and card details (physical or digital) safe,",0
Making sure you close down the curve app when you're not using it,0
Keeping your mobile phone and your email account secure.,0
"If you think your card is lost or stolen, someone knows your security details or there are transactions on your account you don t recognise, you must immediately:",1
"Immediately lock your curve card in the app,",1
"Let us know asap by calling +44(0)2033222585 (lines are open 24/7) or any number linked here, by email on support@curve.com or via the curve app,",1
Stop using your curve account and card until you hear from us.,1
"If you find your curve card after you ve locked it but before you ve notified us, simply unlock it again via the app.",0
"Because we send important notifications and information to you via the curve app and the proper functioning and security of the app relies on updates from time to time, you agree that you will keep the curve app on your mobile devices up to date.",0
Using curve,0
Using your curve card,0
Uses.,0
You can use your curve card to make payments online or at mpos or to withdraw cash.,0
Authorised transactions,0
We ll consider a transaction to be authorised by you when you do at least one of the following:,0
"Enter your pin,",0
"Sign a receipt,",0
"Provide your curve card details (card number, expiry date, cvv number),",0
"Wave or swipe your curve card (digital or physical) over or near a contactless payment reader,",0
"Use your curve card and pin to withdraw cash from a payment terminal, e.g at atm,",0
Select a contact of yours and instruct the transfer of funds to that person in the curve app.,0
"When you use your curve card to make a withdrawal from an atm or make a payment (for example, in a shop or restaurant), we will consider the payment to be authorised by you unless:",0
You let us know that the money has been stolen from your account.,0
Or,0
You don't think we've carried out your instructions correctly.,0
"We start to process your transaction at the time you use your card either for an atm withdrawal, online transaction or payment at a terminal.",0
It s important to note that the authorisation for a transaction lasts for 30 days and can be processed at any time during these 30 days.,0
"If a merchant processes your transaction after 30 days, you agree that we can still process the transaction.",0
You remain responsible under these terms in respect of all transactions you authorise on your curve account including all charges and other amounts incurred.,0
"You also agree that if curve is unable to collect the corresponding funds from your funding card at time these become due to be paid by curve to the merchant, curve is authorised to collect such funds from any of your other funding cards loaded into the curve app.",0
Cancelling transactions.,0
You can cancel a transaction you ve agreed to pay in the future up until close of business on the day before the transaction is due to take place.,0
Just contact us to do this.,0
Changes to payment amounts.,0
"Sometimes, you might make changes to a purchase between the time you authorise the transaction and the time the merchant processes it.",0
"In these cases, the merchant may amend the payment amount to reflect this change.",0
You agree that we may pay the additional amount to the merchant on the basis of your initial authorisation and charge the shortfall to .,0
You.,0
Pre-authorisations.,0
"If you ve used your card to pre-authorise a transaction of less than eur 150 (or its equivalent in your local currency), we may place a block on those funds (meaning you can t use them) or charge the amount to your payment card at the time you pre-authorise the transaction.",0
"If the final amount is less than eur 150, we ll refund or unblock the difference.",0
Continuous payment authority.,0
You can use your curve card to set up a future payment (either on a one-off or recurring basis) on a selected payment card.,0
"We ll make the payment from the payment card you ve selected in the curve app at the time we process the transaction, which may be a different payment card to the one you had selected at the time you set up the future payment.",0
"If you need to cancel such payments, get in touch with us.",0
Spending limits.,0
We have limits on how much you can spend or withdraw - these are set out in your curve app.,0
We may change these limits every now and then.,0
"You can ask us to increase your limits - if we refuse, you have to wait 3 months to request another review.",0
Reasons we may .,0
Refuse or delay a payment?,0
"Security: we re concerned about the security of your curve card or account,",0
"Fraud: we suspect fraud on your account,",0
"Law or regulation: we need to comply with the relevant law or regulation,",0
"Your actions: the transaction breaches limits which apply to your curve account you ve breached these terms, you ve failed to provide us with information we ve asked for, or your account has been blocked for any other legitimate reason, or",0
Third parties: if a third party (e.g.,0
A card network) prevents us from making the payment.,0
"If we are permitted to do so, we ll tell you if we refuse to make a payment and (where possible) why.",0
We may need to contact you urgently if we suspect or find fraudulent activity has occurred on your account (provided we are not prohibited from doing so by law) or if we suffer a security threat.,0
"When we contact you, we will also give you information on how you can minimise any risk to your payment instrument depending on the nature of the fraud or security threat.",0
We ll use the same contact details which you have already provided us with when contacting you.,0
So please make sure you keep your account details up to date by contacting us.,0
What about foreign currency transactions?,0
In case of withdrawals or purchases using your curve card where the currency of your selected payment card is different to the currency of the transaction - curve will perform a currency conversion for you.,0
"If, when making a transaction, you have set your payment .",0
Card currency in the curve app to a different currency than that of the payment card itself then your payment card issuer may charge a fee for using their currency conversion services.,0
This might be in addition to any fees that curve charges you,0
If we have to convert the currency of a payment made using your curve card we ll use an exchange rate which will be either the:,0
Standard exchange rate.,0
"On a weekday we will normally use an exchange rate collected from our wholesale provider, though when the exchange rate is volatile we may use the rate as of midnight on that day.",0
"We ll use this rate during the hours foreign currency markets are open in london, uk.",0
We can let you know the rate for a transaction if you get in touch with us.,0
Weekend exchange rate.,0
"This is the rate at the time the markets are closed in london, u.k.",0
It will apply from the time the markets close until they open again.,0
We can let you know the rate for a transaction if you get in touch with us.,0
Please check our fee schedule to find out the currency conversion fee applicable for the currency exchange transactions.,0
"Exchange rates can fluctuate between the date you made the transaction and the date it s actually processed by the merchant to your account, please note that changes in the exchange rates will be applied immediately and without notice.",0
The rate applied to a transaction will be shown in the curve app,0
"If you use the go back in time feature in relation to a foreign currency transaction, it s possible that a different exchange rate to the one used for the original transaction will apply.",0
"If the merchant subsequently refunds the foreign transaction payment, the exchange rate used will be the one at the date the transaction was settled, not when the refund is settled.",0
You can contact us at support@curve.com for details of the exchange rate for any transaction.,0
You can also find the exchange rate that was applied to your transaction in your curve app.,0
We ll not be responsible to you if you re charged fees or lose any money if you ask the merchant or any other third party to make the currency conversion.,0
Who s responsible for losses on your curve card or account?,0
When you ll be responsible.,0
You re responsible for all losses where:,0
"You ve acted fraudulently,",0
"You deliberately failed to keep your device, account details or your curve card and account security details safe.",0
"If you don t tell us as soon as you realise that your card is lost or stolen, when you think or suspect that someone else knows your security details, or there have been unauthorised transactions on your curve card, you ll have to pay up to eur 50 (or its equivalent in your home currency) of the losses.",0
When we ll be responsible,0
"We'll always try to process your payments correctly and on time, but sometimes things go wrong.",0
"If they do, we ll refund you any money you ve lost as a result of:",0
"Any unauthorised transaction which you ve promptly reported (and within 13 months of the transaction), provided you ve not acted fraudulently or carelessly,",0
"Our mistakes, or",0
Transactions authorised by us after you locked your card (but only to the amount of the original authorisation).,0
We may also refund you where you ve used your curve card to make a payment in the european economic area (eea) without knowing the exact amount beforehand (e.g.,0
When hiring a car) and the final amount is much higher than you reasonably would have expected.,0
Just drop us a line through the app or at support@curve.com as soon as you notice it but not later than .,0
"13 months after the date of the transaction, and provide us with any further information we need to look into this.",0
We ll then make a decision either to refund the transaction or give you reasons for rejecting your request.,0
What can i not use my curve account and curve card for?,0
We know most customers will but you must use your curve account and card responsibly.,0
You can t use them:,0
For anything that s against the law (e.g.,0
"Fraud) or is harmful or disrespectful to others, including any form of abuse of us or our staff,",0
"In breach of these terms,",0
"In a way that might harm our ability to provide our services or may harm our software, systems or hardware,",0
"In a way that your payment card issuer, a card network, our acquirer and/ or payment processor, would see as an abuse of the payments system,",0
"To pay for adult entertainment, gambling, cryptocurrencies, money orders (except wire transfers) and travellers cheques from non-financial institutions,",0
"For cash recycling , which means using your curve card to make an atm withdrawal and using the cash to repay the payment card used for the withdrawal in order to receive rewards on the payment card or your curve card,",0
"To create one or more curve account(s) without our permission attempt to double dip or to do anything during the course of a dispute to receive funds from us and your bank or payment card issuer for the same transaction,",0
To make transactions which are not allowed by the issuer of your linked payment card e.g.,0
Cash advances or transactions for investment purposes.,0
Check your payment card s terms to see what s allowed.,0
Money owed to curve,0
"In the event you owe curve money either for fees or transactions that you have made using curve, or missed subscription fees, we may immediately charge such amounts to any of your payment cards.",0
We reserve the right to collect the amount of your debt to curve by using any payments received to your account.,0
"We may also recover amounts you owe us through legal means, including, without limitation, through the use of a debt collection agency.",0
Curve features,0
Go back in time,0
This allows you to change the payment card you used to pay for certain transactions after they were made.,0
Check out which transactions this is possible for in the curve app (note that we can change this list and restrict customers from using this feature where we have a good reason to do so).,0
"Be aware your card issuer may charge a fee for this, which we re not responsible for.",0
Curve rewards,0
