text,highlighted
Terms of servicethe gist we (the people who work with minds) create free and open source software and run the minds.com social network.,0
We would love for you to use it and help us evolve this document in the direction that best supports and protects minds and its community.,0
Public commentary and peer-review is encouraged via the help &amp.,0
Support group and also on gitlab.,0
The minds basic service of creating a channel or launching a presence on minds.com is free.,0
We also offer paid upgrades for advanced features and other commercial services.,0
Minds software and services are designed to give you as much control and ownership over your social experience as possible and to encourage you to express yourself freely.,0
"However, be responsible in what you publish and use basic internet safety procedures when posting.",0
"In particular, make sure that none of the prohibited items listed in the minds content policy, as defined in section 15, appear on your channel or get linked to/from your channel (things like spam, malware, viruses, or illegal content or serious threats of violence.)",0
"If you find content that is objectionable, then unsubscribe, block, report or just swipe on by.",0
"Minds is an open, free and public commons where users respect the right to use free speech.",0
"Of course, you may find a violation of these terms of service as you traverse minds, in which case please report the channel from the settings cog on the content or channel profile or by email to info@minds.com.",0
"(note, we ve decided to make the below terms of service available under a creative commons attribution-sharealike license, as wordpress provided for us, which means you re more than welcome to repurpose it for your own use.",0
"Just make sure to replace references to us with ones to you, and give an attribution link to minds.com somewhere on your website.)",0
"Minds software and services are owned and operated by minds, inc.",0
"( minds , we or us ).",0
"Our software and services are offered subject to your acceptance without modification of these terms of service and all other operating rules, policies (including our privacy policy) and procedures that may be published from time to time on this site by minds, as well as the terms of sale of minds tokens (available at https://www.minds.com/token) (collectively, these terms ).",0
"We may, from time to time, change or upgrade the services (defined below), in whole or in part.",0
You acknowledge that these terms will apply to any such changes or upgrades.,0
"These terms govern your access to and use of minds tokens in connection with the minds social network, including https://www.minds.com, www.minds.org, and all other network sites under the minds domain ( minds network ), the minds network, and minds mobile applications and any other online services (collectively, the services ) provided by us or our legal affiliates, including any content, functionality, features and applications offered on or through the services to you as a guest or registered user of the services (each, a user ).",0
Please read these terms carefully before you start to use our services.,0
"By using any of the services, you accept these terms, which means that you are entering a legally binding contract with us.",0
"If you do not accept these terms, or if you violate these terms in any way, you may not be authorized to access or use the services, and your minds tokens will be forfeited.",0
You understand that we may change these terms from time to time in our sole discretion and in accordance with section 21 below.,0
"It is your responsibility to periodically check these terms posted so that you are aware of any changes, as they are binding on you.",0
1.,0
Your minds username and channel 1.,0
Use of our services requires a minds username and channel.,0
You are responsible for keeping your password secure.,0
You affirm that you are either more than 18 years of age or possess legal parental or guardian consent to enter into these terms &amp.,0
"Conditions, and to comply with these terms of use.",0
"In any case, you affirm that you are over the age of 13 ( minimum age ), as the website is not intended for children under 13.",0
2.,1
"If you create a channel on the minds platform, you are responsible for maintaining the security of your channel, and you are fully and solely responsible for all activities that occur therein.",1
3.,0
"Minds reserves the right to reclaim any username that has not been active for one year or longer, violates any terms or conditions of these terms or that was created for the sole purpose to resell to a verified user with that same name (a.k.a.",0
Cybersquatting channels.),0
2.,1
Responsibility of registered users 1.,0
You acknowledge that you are solely responsible for all activity that occurs through your channel or username and all of your activity on the minds network.,0
You acknowledge that you are solely responsible for keeping your account information (including your access credentials) secret and secure.,0
"You shall not sell, rent, lease, lend, transfer, license or assign your account, credentials, or any account rights.",0
"With the exception of people or businesses that are expressly authorized to create accounts on behalf of their employers or clients, minds prohibits the creation of accounts on behalf of other persons or entities.",0
"Unless you are so authorized, you shall not create a minds account on behalf of any other person or entity.",0
2.,1
You also acknowledge that:,0
A.,0
"You are solely responsible for your interaction with other users of the services, whether online or offline.",0
You agree that minds is not responsible or liable for the conduct of any user.,0
"Minds reserves the right, but has no obligation, to become involved in disputes between you and other users.",1
B.,0
"You shall not describe or assign keywords to your channel in a misleading or unlawful manner, including any manner which trades on the name or reputation of others.",0
Minds reserves the right to change or remove any description or keyword that it considers unlawful or otherwise likely to cause minds liability.,0
C.,0
"You shall immediately notify minds of any unauthorized uses of your username, account or channel, or of any other breaches of security by emailing security@minds.com.",0
D.,0
"If you operate a channel, comment on a post, post material to minds, post links or create (or allow any third party to create) or otherwise make material available by means of minds, including any text, photo, video, audio, code or other work of authorship (any such material, user content ), you are entirely responsible for the content of, and any liability resulting from or relating to that user content or your conduct.",0
E.,0
"By using minds, you represent and warrant that your user content and conduct do not and will not violate these terms (including our content policy), infringe the rights of any other person or entity (including intellectual property rights and privacy rights), or violate any applicable law, rule, or regulation as detailed in section 26.",0
F.,0
"By submitting user content to minds, you grant minds a perpetual, irrevocable, worldwide, royalty-free, and non-exclusive license to use, reproduce, modify, distribute, publish, process and adapt (each, a use ) your user content for the purpose of providing the services and promoting minds and the services, without any notice of, consent to or compensation for any such use, unless otherwise licensed by the user, through the services.",0
G.,0
"You grant other users permission to share your user content on other minds channels and add their own user content to it (e.g., to remind your user content).",0
H.,0
"All user content, that is not otherwise marked by the license owner, is licensed under the all rights reserved license.",0
I.,0
"If you delete user content, minds will use reasonable efforts to remove it from the minds network, but you acknowledge that caching or references to the user content may not be made immediately unavailable.",0
J.,0
"By registering an account and making user content available, you further represent and warrant that the user content does not violate the minds content policy referenced in section 15.",0
K.,0
"Your use of the services and user content will not infringe the rights of any other party (including intellectual property rights and privacy rights) or violate any applicable law, rule, or regulation.",0
L.,0
"Any use by minds of any user content will not infringe the rights of any other party (including intellectual property rights and privacy rights) or violate any applicable law, rule, or regulation.",0
M.,0
"If any other party has rights to intellectual property you incorporate into any user content, you have either (i) received permission from such other to so incorporate such intellectual property into such user content, including but not limited to any software, or (ii) secured from such other party a waiver as to all rights in or to such user content.",0
N.,0
You have fully complied with any third-party licenses relating to all user content and have done all things necessary to grant to minds the license set forth under section 2(f) and to successfully grant to others any relevant rights under any such third-party licenses.,0
O.,0
"You also give other users permission to share your content under the legal terms outlined in the license you select, whether creative commons, all rights reserved, or any other available license.",0
3.,0
Prohibited usesyou shall not use or access any of the services:,0
1.,0
"In any way that violates any applicable united states federal, state or local law, rule, or regulation (including, without limitation, any intellectual property laws or privacy laws or laws regarding sanctions, or the export of data or software to and from the united states or other countries).",0
2.,1
"To post unlawful, infringing, or other content not allowed under these terms.",0
3.,0
"To impersonate, attempt to impersonate, or falsely imply that you are associated with minds, another user, or any other person or entity.",0
4.,1
"In any manner that could disable, alter, overburden, damage, or impair the services or the minds network, or engage in any other conduct that restricts or interferes with any other party s use, which, as determined by us, may harm minds or users of the services or expose them to liability, including but not limited to transmitting any worms, viruses, spyware, malware or any other code of a destructive, malicious, intrusive, or disruptive nature intended to cause denial of service.",0
5.,0
"To use, distribute, modify, create derivative works from, or copy the services or any feature of the services or any user account or channel (including any user content) in whole or in part, or decompile, reverse engineer, disassemble, attempt to derive the source code or underlying algorithms of the services or any feature of the services, except as may be permitted under any license applicable to the services, which may be viewed at https://gitlab.com/minds.",0
6.,0
"To create accounts or access data (including user information) through unauthorized means, by using an automated device, caching, script, bot, spider, crawler or scraper or any such weaponized capability intended as a malware threat to minds.",0
7.,0
"To attempt to gain unauthorized access, or permit unauthorized access, to the services or any feature of the services (including any user account or channel) or any of our related systems or networks, or bypass any measures we take to restrict access to the services or related systems or networks.",0
8.,0
"To substantially replicate products or services offered by minds in an impersonating manner, including by republishing minds content or creating a separate publishing platform.",0
Or,0
9.,0
"Without limiting any of the above representations or warranties or obligations, minds reserves the right to, in minds sole discretion, (i) reject or remove any user content that, in minds reasonable opinion, violates any term or condition of these terms or policies of minds or is in any way unlawful under connecticut state law (ii) ban and remove any channel that, in minds reasonable opinion, violates any term or condition of these terms or policies of minds or is in any way unlawful or (iii) terminate or deny access to and use of the services to any person or entity whose use of minds and its services is unlawful.",0
10.,0
"In the event a channel is banned due to the breach of these terms, and the channel owner no longer has access to the channel, minds will have no obligation to provide a refund of any kind including refund of any outstanding wallet amounts such as token balances or any amounts previously paid.",0
Please direct any questions to info@minds.com.,0
4.,1
Https 1.,0
"We support https and encrypt all sensitive information stored at rest on minds.com, and we offer free https on all minds.com sites by default.",0
"By signing up and using a custom domain or sub-domain on minds.com, you authorize us to act on the domain name registrant s behalf (by requesting the necessary certificates, for example) for the sole purpose of providing https on your site.",0
5.,0
Domain names 1.,0
Minds provides https on all subdomains.,0
Minds allows custom domains through the minds hosting service and reserves the right to require https before publishing such custom domains.,0
Your use of the domain name is also subject to the policies of the internet corporation for assigned names and numbers ( icann ).,0
2.,1
A summary of your rights and responsibilities as a domain name registrant under icann s 2009 registrar accreditation agreement can be found at: https://www.icann.org/resources/pages/benefits-2013-09-16-en,0
3.,0
You can learn more about domain name registration generally at: https://www.icann.org/resources/pages/educational-2012-02-25-en 6.,0
Intellectual property rights 1.,0
"We grant you a limited, non-exclusive, non-sublicensable, non-transferable license to access and use the services for lawful purposes in accordance with these terms.",0
"The services contain materials owned or licensed by minds, including name, logo, source code and executable code, text, images, audio/visual works, icons and scripts and other intellectual property (collectively, minds content ).",0
"Minds content is protected by copyright, trademark, patent, trade secret and other laws, and, as between you and minds, minds owns and retains all rights in minds content and the services.",0
2.,1
"You shall not remove, alter or conceal any copyright, trademark, service mark or other proprietary rights notices incorporated in or accompanying minds content, and you shall not reproduce, modify, adapt, prepare derivative works based on, perform, display, publish, distribute, transmit, broadcast, sell, license or otherwise exploit any minds content or the services, except as may be permitted by these terms.",0
3.,0
You will own all intellectual property rights in user content you create using the services except to the extent they incorporate minds content or other intellectual property owned or licensed by minds.,0
4.,1
"Minds reserves the right to display attribution text or links in your channel footer or toolbar, denoting attribution to minds.",0
The toolbar may not be altered or removed.,0
Attribution text or links may only be hidden if you are subscribed to an enhanced level of service that permits the user to do so.,0
7.,0
"Reporting copyright infringement, dmca policy and other violations 1.",0
"Minds prohibits users of our services from submitting, uploading, posting or otherwise transmitting any materials that violate another person s intellectual property rights.",0
"To report allegations of infringement, please contact minds at copyright@minds.com.",0
2.,1
"As minds asks others to respect our intellectual property rights, we respect the intellectual property rights of others.",0
"If you believe that material located on or linked to by minds violates your copyright, you are encouraged to notify minds in accordance with minds digital millennium copyright act ( dmca ) policy, available at https://www.minds.com/p/dmca.",0
Minds will respond to all such notices in accordance with applicable law.,0
"Minds will ban or terminate a channel s access to and use of the services if, under appropriate circumstances, that channel is determined to be a repeat copyright or intellectual property rights infringer.",0
"In the case of such ban or termination, minds will have no obligation to provide access to any services, minds tokens or any refund including any amounts previously paid to minds.",0
8.,0
Monitoring and enforcement.,0
Ban and terminationwe have the right to:,0
1.,0
"Modify, ban or terminate the services for any reason, without notice, at any time, and without liability to you.",1
2.,1
"Refuse, terminate, or suspend your access to all or part of the services for any or no reason,",1
"Including, without limitation, any violation of these terms.",0
And,0
3.,0
Force forfeiture of any username for any reason.,1
4.,1
"Upon any such refusal, termination or suspension of your access to the services, all licenses and other rights granted to you under these terms will immediately cease, and any outstanding balance of offchain minds tokens will be forfeited to minds.",0
9.,0
Linking to the services 1.,0
"You may link to our website homepage, provided you do so in a way that is fair and legal, but you must not establish a link in such a way as to suggest any form of association, approval, or endorsement on our part without our express written consent, which may be withheld for any reason or no reason in our sole discretion.",0
2.,1
"You may use these features solely as they are provided by us, and must not otherwise: establish a link from any website that is not owned by you.",0
"Cause the services or portions of it to be displayed on, or appear to be displayed by, any other site (for example, scraping, framing, deep linking, or in-line linking).",0
Or take any action with respect to the services that is inconsistent with these terms.,0
10.,0
Links on minds services 1.,0
"If the services contain links to other sites and resources provided by third parties, these links are provided for your convenience only.",0
"This includes links contained in advertisements, including banner advertisements and sponsored links.",0
"You acknowledge that we have no control over the contents of those sites or resources, and accept no responsibility, and we disclaim any liability, for them or for any loss or damage that may arise from your use of them.",0
"If you decide to access any of the third-party websites linked to our services, you do so entirely at your own risk and subject to the terms and conditions of use for such websites.",0
11.,0
Advertisements 1.,0
"As a minds channel, you agree that minds boost will inject advertised content into your newsfeed to satisfy the demand of minds publishers.",0
"In addition, you agree that other minds channels to which you are subscribed may remind advertised content to your feed.",0
Users may opt-out of minds boost by joining minds plus.,0
12.,0
Services content 1.,0
"We may update our services from time to time, but they will not necessarily be complete or up-to-date at any given time.",0
"Any of the material in the services may be out of date at any given time, and we are under no obligation to update such material.",0
2.,1
"You acknowledge that we may not always identify paid services, sponsored content, or commercial communications as such, except as may be required by applicable law.",0
3.,0
"Although it is minds intention for the services to be available as much as possible, there will be occasions when the services may be interrupted, including, without limitation, for scheduled or unscheduled maintenance or upgrades, for emergency repairs, or due to failure of telecommunications links and/or software or hardware.",0
4.,1
"Minds reserves the right to remove any content from the services that is deemed in violation of these terms, without prior notice.",1
"Content removed from the services may continue to be stored by minds, including, without limitation, in order to comply with certain legal obligations, but may not be retrievable without a valid court order.",0
13.,0
Geographic restrictions 1.,0
Minds is based in the united states and provides its services for use to persons located all over the world with the exception of those countries that are sanctioned by ofac (https://www.treasury.gov/resource-center/sanctions/programs/pages/programs.aspx).,0
Access to the services may not be legal by certain persons or in certain countries.,0
"If you access the services from outside the united states, you do so on your own initiative and are responsible for compliance with local laws, though these terms are governed solely by united states law.",0
14.,0
Payments and renewals 1.,0
"Minds offers optional paid services such as minds tokens, hosting, subscriptions, monetization, additional storage, bandwidth, minds plus, video transcoding, and boost (any such services, an upgrade ).",0
"By accessing an upgrade you agree to pay minds the one time, monthly or annual subscription fees indicated for that service.",0
Payments will be charged on a pre-pay basis on the day you sign up for an upgrade and will cover the use of that service for a monthly or annual subscription period as indicated.,0
A.,0
"Automatic renewal: unless you notify minds before the beginning of the applicable subscription period that you want to cancel, your subscription or service will automatically renew, and you authorize us to collect the then-applicable annual or monthly subscription fee for such upgrade (as well as any taxes) using any credit card or other payment mechanism we have on record for you.",0
Upgrades can be cancelled at any time in user settings.,0
B.,0
Refund policy: all sales of minds tokens are final and non-refundable.,0
Any disputes should be directed to info@minds.com.,0
C.,0
Additional users: minds will calculate your site s hosting charge based on estimated hours of work and monthly active users (mau) calculated as the peak number of unique active users who have initiated at least one session over a one-month period.,0
D.,0
Minds services: consulting and support services are provided by minds under the terms and conditions for each such service engagement.,0
Please contact info@minds.com for more information.,0
15.,0
Content policy 1.,0
"The minds content policy (the ""content policy""), as may be amended from time to time, is hereby incorporated by reference and made a part hereof in its entirety.",0
Minds will notify users of any changes to the content policy through the notice section on https://minds.com.,0
16.,0
Responsibility of visitors 1.,0
"Minds has not reviewed, and cannot review, all of the material, including computer software, posted to our website, and cannot therefore be responsible for that material s content, use or effects.",0
"By operating our website, minds does not represent or imply that it endorses the material there posted, or that it believes such material to be accurate, useful or non-harmful.",0
2.,1
"You are responsible for taking precautions as necessary to protect yourself and your computer systems from viruses, worms, trojan horses, and other harmful or destructive content.",0
3.,0
"Our website may contain content posted by others that is offensive, indecent, or otherwise objectionable, as well as content containing technical inaccuracies, typographical mistakes, fake news, propaganda, satire, or other errors.",0
4.,1
"Our website may also contain material posted by others that violates the privacy or publicity rights, or infringes the intellectual property and other proprietary rights, of third parties, or the downloading, copying or use of which is subject to additional terms and conditions, stated or unstated.",0
17.,0
Distribution of minds tokens 1.,0
Minds tokens are sold by minds pursuant to the minds tokens terms of sale ( terms of sale ) available at https://www.minds.com/token.,0
Users must review and agree to these terms of sale before purchasing minds tokens from minds.,0
2.,1
"Minds tokens may also be distributed by minds in connection with the services, including, but not limited to, in the form of user rewards and developer rewards as provided in the minds whitepaper, or as may be set forth in other policies of minds, as such may be adopted from time to time ( other policies ).",0
3.,0
"Users that receive minds tokens from minds acknowledge and agree that the minds tokens only entitle the owner to access and use certain aspects of the minds network and do not entitle the owner to any rights with respect to minds, including but not limited to, ownership, voting rights or other rights.",0
"Users agree to use minds tokens in accordance with these terms, the terms of sale, and such other policies, if any, and acknowledge and accept the risk disclosures set forth in the terms of sale ( risk disclosures ).",0
"Minds tokens do not confer any rights other than rights relating to the provision and receipt of the services described above, subject to limitations and conditions described in these terms.",0
"Minds tokens are not intended to be a virtual currency, security, derivative or any other kind of financial instrument.",0
4.,1
"You are responsible for implementing reasonable measures for securing the wallet, vault or other storage mechanism you use to receive and hold minds tokens, including any requisite private key(s) or other credentials necessary to access such storage mechanism(s).",0
