text,highlighted
"If your private key(s) or other access credentials are lost, you acknowledge that you may lose access to your minds tokens, and that there is no recovery possible, and that minds cannot recover them for you and is in no way responsible for any such losses.",0
"You will implement reasonable and appropriate measures designed to secure access to (i) any device connected with the email address associated with your account, (ii) private keys required to access any relevant ethereum address, wallet or your minds tokens, and (iii) your username, password and any other login or identifying credentials.",0
5.,0
"By opting to receive minds tokens, you represent and warrant that:",0
A.,0
"You are agreeing to participate in the minds network in some manner, and understand that the ecosystem surrounding this project is not solely dependent upon the efforts of minds, but by holders of minds tokens engaging with the services.",0
B.,0
You are not a citizen or resident of a country that prohibits the ownership of minds tokens and/or access to or use of other aspects of the services.,0
C.,0
"You have sufficient understanding of cryptographic tokens, token storage mechanisms (such as token wallets), and blockchain technology to understand these terms, the services, and the risks and implications of purchasing or otherwise obtaining the minds tokens.",0
D.,0
"You have read, understood and agreed to these terms, the terms of sale (including the risk disclosures), and the minds whitepaper, and such other policies, if any, and will periodically check for updates to these documents which we provide through the services including on our website (https://www.minds.com) or other channels.",0
E.,0
"You understand that the minds tokens confer only the right to access and use certain features of the services and confer no other rights of any form or nature with respect to the ethereum blockchain network or minds, including, but not limited to, any voting, distribution, redemption, liquidation, property (including all forms of intellectual property), or other financial or legal rights.",0
F.,0
"You understand that the features of the services are subject to change at any time or may be unavailable or may have limited available at any time, with or without notice, and you acknowledge that your expectations regarding one or more features of the services and/or minds tokens may not be met and that any failure to meet your expectations will not be deemed a breach of these terms by minds.",0
G.,0
"You agree to promptly provide to minds, upon request, proof of identity and/or source of funds and/or other documentation or other information that minds may request from time to time in connection with minds obligations under, and compliance with, applicable laws and regulations, including but not limited to anti-money laundering legislation, regulations or guidance and/or tax information reporting or withholding legislation, regulations or guidance, or any know your customer requirements and policies.",0
H.,0
You are legally permitted to use software and contribute to the continued development of the minds network and the services.,0
I.,0
"You will comply with any applicable tax obligations in your jurisdiction arising from your ownership and use of minds tokens and by holding or using the minds tokens, and to the extent permitted by law, you agree not to hold any third party (including developers, auditors, contractors, or founders) liable for any tax liability associated with or arising from the creation, ownership or use of the minds tokens or any other action or transaction related to the services.",0
J.,0
"You acknowledge that the tax characterization of the minds tokens is uncertain, and that your use, purchase, or sale of minds tokens may result in adverse tax consequences to you, including withholding taxes, income taxes and tax reporting requirements, that new or future changes to united states, and non-united states tax laws could adversely affect you, minds and/or minds tokens.",0
K.,0
"You understand and acknowledge that regulators continue to provide guidance with respect to ambiguities in existing laws and regulations in the context of crypto token sales, that lawmakers and regulators are considering and may approve new laws and regulations that govern the offering of crypto tokens, and that it is possible that a government or regulatory agency will pursue minds and require it to suspend or cease its business operations and the platform in light of new interpretation of existing laws or regulations, or passage of new laws and regulations.",0
L.,0
You are not obtaining minds tokens from countries or regions comprehensively sanctioned by the u.s.,0
"Office of foreign assets control ( ofac ), or on behalf of governments of these countries or regions, nor will you use the minds tokens to conduct or facilitate any transactions with persons or entities located in these countries or regions.",0
M.,0
"You are not (i) a citizen or resident of a geographic area in which access to or use of the services is prohibited by applicable law, decree, regulation, treaty, or administrative act, (ii) a citizen or resident of, or located in, a geographic area that is subject to u.s.",0
"Or other applicable comprehensive country sanctions or embargoes, or (iii) an individual, or an individual employed by or associated with an entity, identified on the u.s.",0
"Department of commerce s denied persons, unverified, or entity list, the u.s.",0
"Department of treasury s specially designated nationals or blocked persons or foreign sanctions evaders lists, or the u.s.",0
Department of state s debarred parties list.,0
You will not use the minds tokens to conduct or facilitate any transactions with such persons described above.,0
"You agree that if your country of residence or other circumstances change such that the above representations are no longer accurate, that you will immediately cease using the services.",0
"If you are registering to use the services on behalf of a legal entity, you further represent and warrant that (i) such legal entity is duly organized and validly existing under the applicable laws of the jurisdiction of its organization, and (ii) you are duly authorized by such legal entity to act on its behalf and bind it to these terms.",0
N.,0
"You understand that minds tokens are a utility token not intended to be a digital currency, security, derivative or any other kind of financial instrument.",0
O.,0
"You understand and acknowledge that these terms shall not be construed as an invitation to the public to subscribe for any securities, and you understand and acknowledge that no actions of, or documentation issued by minds, shall be construed as such.",0
P.,0
You understand that minds is not registered with or licensed by any financial regulatory or securities authority.,0
"Accordingly, no financial regulatory or securities authority has passed upon the contents of these terms or the merits of purchasing minds tokens, nor have these terms been filed with, or reviewed by any financial regulatory or securities authority.",0
Q.,0
You are of a sufficient age to legally obtain and use minds tokens,0
R.,0
"You understand with regard to minds tokens, that we make no guarantees or representations that you will be able to resell, trade or exchange minds tokens, or as to their future value, or that minds tokens have or may have any uses outside the minds network.",0
"You further understand and acknowledge that we make no guarantees or representations as to any market liquidity of minds tokens, and you understand and acknowledge that the value of minds tokens over time may experience extreme volatility or depreciate in full.",0
S.,0
"You understand that you bear the sole responsibility to determine if the creation, ownership or use of minds tokens, the potential appreciation or depreciation in the value of minds tokens over time, and the sale and purchase of minds tokens and/or any other action or transaction related to minds tokens or the services have tax implications.",0
T.,0
You waive the right to participate in a class action lawsuit or a class wide arbitration against any entity or individual involved with the creation of minds tokens.,0
U.,0
"You understand the creation of the minds token does not involve the purchase of shares or any equivalent in any existing or future public or private company, corporation or other entity in any jurisdiction.",0
V.,0
You understand that you have no right against any other party to request any refund of cryptocurrency exchanged for minds tokens under any circumstances.,0
And,0
W.,0
You understand that you are not permitted to sell any minds tokens to any other user or other third party and that the company is not responsible for any purported sale from a third party.,0
18.,0
Promotions 1.,0
"Minds may, from time to time, offer minds tokens through promotional means such as in rewards.",0
"Rewards will be governed by their own set of terms and conditions and it is your responsibility to abide by such terms and conditions, however, in the event there is a conflict between any reward terms and conditions and these terms, these terms shall control.",0
2.,1
No purchase shall be necessary to participate in any token reward program.,0
A.,0
Offers.,0
"Minds reserves the right, in its sole discretion, to cancel or modify any reward offer if fraud or other failure destroys the integrity of the offer.",0
"In addition, minds reserves the right, in its sole discretion, to extend or modify the time period during which a reward offer is available.",0
"Minds does not assume any responsibility for incorrect or inaccurate capture of registration information, technical malfunctions, human or technical error, seeding or printing errors, lost/delayed/garbled data or transmissions, omission, interruption, deletion, defect, or failures of any telephone or computer line or network, computer equipment, software or any combination thereof.",0
Registration materials that have been tampered with or altered are void.,0
"If, in our opinion, any offer is compromised or becomes technically corrupted in any way, electronically or otherwise, we reserve the right to cancel, terminate, or suspend the offer.",0
B.,0
Restrictions.,0
"There shall be no substitution, transfer or cash equivalent for tokens received through any promotional offer, except that minds may, at its sole discretion, substitute items or cash of comparable value as applicable.",0
"All expenses, transaction fees and costs associated with the acceptance or use of the tokens that are not expressly specified herein, or in the reward offer s official rules, are your sole responsibility.",0
"All federal, state and local taxes (as applicable) are your sole responsibility.",0
C.,0
Release from liability for rewards.,0
"By accepting the tokens received through any rewards offer, you agree to hold harmless minds, its parents, affiliates, subsidiaries, officers, directors, shareholders, agents, employees and all other associates ( released parties ) from and against any and all claims and liability arising out of your acceptance, transfer or use of the tokens or acceptance of any minds offers.",0
"You assume all liability for any injury or damage caused or claimed to be caused by accepting a minds reward offer or use, transfer or redemption of the tokens.",0
Information collected during registration will be used in accordance with these terms and statements made in any promotional offer materials.,0
Caution: any attempt by any person or entity to deliberately damage any website or undermine the legitimate operation of a minds reward offer is a violation of criminal and civil laws.,0
"Should such an attempt be made, the released parties reserve the right to seek damages from any such person or entity to the fullest extent permitted by law.",0
D.,0
Disputes: you agree to abide and be bound by the dispute resolution requirements as set forth in these terms and any additional dispute resolution requirements as outlined in a specific promotion s official rules.,0
19.,0
Restricted use 1.,0
You may not use the services or any associated api access to impersonate or attempt to impersonate minds or any products or services offered by minds.,0
"To falsely imply that you are associated with minds, another user, or any other person or entity.",0
Or for any other fraudulent or misleading purpose.,0
Any product or service created through any api of minds must include a disclaimer that substantially sets forth that such product or service is not offered by minds and that minds does not condone sharing account credentials with any third party.,0
2.,1
Your use of the services is at all times subject to these terms and the terms and conditions of the gnu affero general public license v3.0 ( agpl-3.0 ).,0
"If minds believes, in its sole discretion, that you have violated or attempted to violate these terms or the agpl-3.0, your ability to use and access the services may be temporarily or permanently revoked, with or without notice.",0
3.,0
"You may not farm, automate voting chains, game, manipulate or spam the site in order to gain minds tokens in an unfair or deceitful manner.",0
20.,0
Minds content review policy 1.,0
"We have not reviewed, and cannot review, all of the material, including computer software, made available through the websites and webpages to which minds.com links, and that link to minds.com.",0
Minds does not have any control over such other websites and is not responsible for their contents or their use.,0
"By linking to any such other website, minds does not represent or imply that it endorses such website.",0
"You are responsible for taking precautions as necessary to protect yourself and your computer systems from viruses, worms, trojan horses, and other harmful or destructive content.",0
Minds disclaims any responsibility for any harm resulting from your use of such other websites and webpages.,0
21.,0
Changes 1.,0
We may change or update the services in whole or in part at any time and we reserve the right to change these terms at any time.,0
"If we make changes to these terms that are material, we will let you know by posting in the notice section on the newsfeed of the web version of minds, or by sending you an email or other communication.",0
The notice will designate a reasonable period of time after which the changes to these terms will take effect.,0
"If you disagree with our changes, then you should stop using the services within the designated notice period.",0
"Your continued use of the services indicates your acceptance of such changes, your continued use of the services will be subject to these terms, as changed.",0
"However, any dispute that arose before the changes shall be governed by the terms (including the binding individual arbitration clause) that were in effect when the dispute arose.",0
22.,0
Privacy policy.,0
Other policies 1.,0
"Your access to and use of the services is at all times subject to our privacy policy which addresses how we collect, use, share, and store your information.",0
Your access to and use of the services may be subject to one or more other policies adopted from time to time by minds.,0
2.,1
"If we adopt a new policy relating to the services that is material, we will let you know by posting on one of our blogs, or by sending you an email or other communication before the new policy takes effect.",0
The notice will designate a reasonable period of time after which such new policy will take effect.,0
"If you disagree with such new policy, then you should stop using the services within the designated notice period.",0
"Your continued use of the services indicates your acceptance of such new policy, and your continued use of the services will be subject to such new policy.",0
23.,0
Disclaimer of warranties and limitation of liability 1.,0
You understand that we cannot and do not guarantee or warrant that files available for downloading from the internet or the services will be free of viruses or other destructive code.,0
"You are responsible for implementing sufficient procedures and checkpoints to satisfy your particular requirements for anti-virus protection and accuracy of data input and output, and for maintaining a means external to our site for any reconstruction of any lost data.",0
2.,1
"Violation of these terms may, in minds sole discretion, result in termination of your account.",0
You understand and agree that minds cannot and will not be responsible for the content posted on the services and you use the services at your own risk.,0
"If you violate the letter or spirit of these terms, or otherwise create risk or possible legal exposure for minds, we can stop providing all or part of the services to you.",0
3.,0
"To the fullest extent permitted by the applicable law, minds offers the services as-is and makes no representations or warranties of any kind concerning the services, express, implied, statutory or otherwise, including, without limitation, warranties of title, merchantability, fitness for a particular purpose, non-infringement, or compatibility with any software or hardware.",0
4.,1
"Minds does not warrant that the functions or content contained on the services will be available, uninterrupted or error-free, that defects will be corrected, or that minds servers are free of viruses or other harmful components through use or downloading material from the services.",0
5.,0
"Minds does not warrant or make any representation regarding use or the result of use of the content in terms of accuracy, reliability, or otherwise.",0
6.,0
Your use of the services and its content is at your own risk.,0
"Except to the extent required by applicable law and then only to that extent, in no event will minds, its employees, officers, directors, affiliates or agents ( the minds parties ) be liable to you on any legal theory for any incidental, direct, indirect, punitive, actual, consequential, special, exemplary or other damages, including without limitation, loss of revenue or income, lost profits, pain and suffering, emotional distress, cost of substitute goods or services, or similar damages suffered or incurred by you or any third party that arise in connection with the services (or the termination thereof for any reason), even if the minds parties have been advised of the possibility of such damages.",0
7.,0
"Minds shall not be responsible or liable whatsoever in any manner for any claims of infringement relating to the services, for your use of the services, or for the conduct of third parties whether on the services or relating to the services.",0
8.,0
"In no event will the aggregate liability of minds and the minds parties (jointly), in any action or claim, whether in contract, warranty, tort (including negligence, whether active, passive or imputed), or other theory, arising out of or relating to the services, these terms, or the sale or use of, or inability to use, minds tokens in connection with the services, exceed the amount you paid to us for minds tokens and use of the services within the 12-month period preceding the event giving rise to such action or claim.",0
24.,0
Indemnification 1.,0
"You agree to indemnify and hold harmless the minds parties from and against any and all loss, expenses, damages, and costs, including without limitation reasonable attorneys fees, resulting, whether directly or indirectly, from your violation of these terms.",0
You also agree to indemnify and hold harmless the minds parties from and against any and all claims brought by third parties arising out of your use of the services.,0
25.,0
"Dispute resolution, arbitration.",0
Jurisdiction 1.,0
Please read the following section carefully because it requires you to arbitrate certain disputes and claims with minds and limits the manner in which you can seek relief from us.,0
A.,0
Binding arbitration.,0
"Except for any disputes, claims, suits, actions, causes of action, demands or proceedings (collectively, disputes ) in which either party seeks injunctive or other equitable relief for the alleged unlawful use of intellectual property, including, without limitation, copyrights, trademarks, trade names, logos, trade secrets or patents, you and minds (i) waive your and minds respective rights to have any and all disputes arising from or related to these terms resolved in a court, and (ii) waive your and minds respective rights to a jury trial.",0
"Instead, you and minds will arbitrate disputes through binding arbitration pursuant to the federal arbitration act, 9 u.s.c.",1
1 et seq.,1
"( faa ), to the maximum extent permitted by applicable law.",1
(this includes the referral of a dispute to one or more persons charged with reviewing the dispute and making a final and binding determination to resolve it instead of having the dispute decided by a judge or jury in court).,0
B.,0
"No class arbitrations, class actions or representative actions.",0
"Any dispute arising out of or related to these terms is personal to you and minds and will be resolved solely through individual arbitration and will not be brought as a class arbitration, class action or any other type of representative proceeding.",0
There will be no class arbitration or arbitration in which an individual attempts to resolve a dispute as a representative of another individual or group of individuals.,0
"Further, a dispute cannot be brought as a class or other type of representative action, whether within or outside of arbitration, or on behalf of any other individual or group of individuals.",0
C.,0
Notice.,0
Informal dispute resolution.,0
"Each party will notify the other party in writing of any dispute within thirty (30) calendar days of the date it arises, so that the parties can attempt in good faith to resolve the dispute informally.",0
Notice to minds shall be sent by email to minds at info@minds.com.,0
Notice to you shall be by email to the then-current email address in your account.,0
"Your notice must include (i) your name, postal address, email address and telephone number, (ii) a description in reasonable detail of the nature or basis of the dispute, and (iii) the specific relief that you are seeking.",0
"If you and minds cannot agree how to resolve the dispute within thirty (30) calendar days after the date notice is received by the applicable party, then either you or minds may, as appropriate and in accordance with these terms, commence an arbitration proceeding or, to the extent specifically provided for in these terms, file a claim in court.",0
D.,0
Process.,0
Any arbitration will occur in the state of connecticut.,0
"Arbitration will be conducted confidentially by a single arbitrator in accordance with the rules of the judicial arbitration and mediation services ( jams ), which are hereby incorporated by reference.",0
"The state and federal courts located in the state of connecticut will have exclusive jurisdiction over (i) any appeals and the enforcement of an arbitration award, or (ii) any claim filed in court where permitted in these terms.",0
E.,0
Authority of arbitrator,0
"As limited by the faa, these terms and the applicable jams rules, the arbitrator will have (i) the exclusive authority and jurisdiction to make all procedural and substantive decisions regarding a dispute, including the determination of whether a dispute is arbitrable, and (ii) the authority to grant any remedy that would otherwise be available in court.",0
"Provided, however, that the arbitrator does not have the authority to conduct a class arbitration or a representative action, which is prohibited by these terms.",0
"The arbitrator may only conduct an individual arbitration and may not consolidate more than one individual s claims, preside over any type of class or representative proceeding or preside over any proceeding involving more than one individual.",0
F.,0
Rules of jams,0
The rules of jams and additional information about jams are available on the jams website.,0
"By agreeing to be bound by these terms, you either (i) acknowledge and agree that you have read and understand the rules of jams, or (ii) waive your opportunity to read the rules of jams and any claim that the rules of jams are unfair or should not apply for any reason.",0
G.,0
Injunctions and court proceedings,0
"With respect to any action or proceeding for which courts are an expressly permitted method of adjudication hereunder (set forth below), the exclusive jurisdiction and venue for all such actions or proceedings arising out of, or related to, these terms will be in an appropriate state or federal court located in the state of connecticut.",0
"(the designated courts ), and the parties hereby irrevocably consent to the personal and subject matter jurisdiction of such court, waive any claim that such courts do not constitute a convenient and appropriate venue for such actions or proceedings, and waive the right to a trial by jury.",0
Each party consents to service of process upon itself by means of any of the methods for delivery of notice that are specified in these terms.,0
H.,0
"To the extent that arbitration pursuant to the terms of this section is not permitted under applicable law, a party may seek resolution of any dispute in the designated courts.",0
I.,0
"To the extent the parties mutually-agree to forego arbitration for a dispute, the parties shall seek resolution of such dispute in the designated courts.",0
J.,0
Permitted appeals and/or enforcement of an arbitration award shall take place in the designated courts.,0
K.,0
"Certain breaches of these terms by a user may, by its gravity or nature, cause immediate and irreparable injury to minds that cannot be adequately compensated for in damages, including, without limitation, infringement of minds intellectual property rights.",0
