text,highlighted
Terms of service,0
"Last updated: september 2nd, 2019",0
# welcome to replika!,0
We re so happy to have you here.,0
"These terms of service ( terms ) govern your use of replika and the software, content, and services (collectively, services ) offered through: our website www.replika.ai and its subdomains (the website ), our mobile apps replika for android and replika for ios (the apps ).",0
Please read these terms carefully before you start using the services.,0
"The terms replika, us or we refers to luka, inc., a software company who designed and built replika, incorporated in delaware, and operating in san francisco, ca.",0
"The term device refers to the device which is used to access the services including but not limited to computers, smartphones and tablets.",0
The term you refers to the user of the services.,0
"When you sign up for any of the services or otherwise use or access them, you agree to be bound by these terms and all applicable laws, rules, and regulations.",0
"By using the services, you indicate that you accept these terms and that you agree to abide by them.",0
"If you do not agree to these terms, please refrain from using the services.",0
Our contact email address is my@replika.ai.,0
All correspondence to replika including any queries you may have regarding your use of the services or these terms should be sent to this contact email address.,0
Please note that these terms contain an arbitration clause.,0
"Except for certain types of disputes mentioned in the arbitration clause, you and replika agree that disputes relating to these terms or your use of the services will be resolved by mandatory binding arbitration, and",0
You and replika waive any right to participate in a class action lawsuit or class-wide arbitration,1
# 1.,0
Our services,0
Replika offers a self-help program based on communication with your personal chatbot through a text and voice interface.,0
# 1.1.,0
Medical disclaimer,0
Replika is a provider of software and content designed to improve your mood and emotional wellbeing.,0
"However we are not a healthcare or medical device provider, nor should our services be considered medical care, mental health services or other professional services.",0
Only your physician or other healthcare providers can do that.,0
"While there is third party evidence from research that certain conversation techniques implemented in replika can assist in the recovery process for a wide array of conditions, replika makes no claims, representations or guarantees that the services provide a therapeutic benefit.",0
# 1.2.,0
Emergencies,0
Use of the services is not for emergencies.,0
"If you think you have a medical or mental health emergency, call 911 or go to the nearest open clinic or emergency room.",0
"If you are considering or committing suicide or feel that you are a danger to yourself or others, you must discontinue use of the services immediately, call 911 or notify appropriate police or emergency medical personnel.",0
# 1.3.,0
Modifications to the services,0
"We reserve the right to modify or discontinue, temporarily or permanently, the services (or any part thereof) with or without notice.",0
"You agree that replika will not be liable to you or to any third party for any modification, suspension or discontinuance of any the services.",0
# 2.,0
Membership &amp.,0
Subscriptions,0
# 2.1.,0
Becoming a member,0
You will be required to register ( create an account ) with replika and become a replika member in order to access and use the services.,1
"If you choose to register for the services, you agree to provide and maintain true, accurate, current and complete information about yourself as prompted by the registration forms.",0
Registration data and certain other information about you are governed by our privacy policy.,0
# 2.2.,0
Once a member,0
"You are responsible for maintaining the confidentiality of your password and account, if any, and are fully responsible for any and all activities that occur under your password or account.",1
"You agree to (a) immediately notify replika of any unauthorized use of your password or account or any other breach of security, and (b) ensure that you exit from your account at the end of each session when accessing the services.",0
Replika will not be liable for any loss or damage arising from your failure to comply with this section.,0
# 2.3.,0
Your membership,0
"As a replika member, you will receive access to content, features, and functions of the services that are not available to non-members.",0
"By agreeing to become a member you opt-in to receive occasional special offers, marketing, survey, and services-based communication emails.",0
You can easily unsubscribe from replika commercial emails by following the opt-out instruction in these emails.,0
Replika memberships and subscriptions are not transferable and therefore cannot be sold or exchanged or transferred in any way whatsoever.,0
# 2.4.,0
Subscriptions,0
# 2.4.1.,0
Choosing a subscription program,0
"Once you become a replika member, you can choose one of the subscription programs offered in replika:",0
"Free use : a free-of-charge program, which gives limited access to the services.",0
The free use is aimed at users who cannot afford any of our subscription-fee based programs.,0
We reserve the right to deny the free use to anyone at any time on our own discretion.,0
"Replika pro : a subscription-fee based program, which gives full access to the services.",0
"You can become a subscriber to a paid subscription program (b) or (the paid subscriptions ) by purchasing a subscription to the services within the apps, where allowed by the app marketplace partners (apple itunes store and google play store).",0
# 2.4.2.,0
Maintaining a paid subscription,0
"Any of our paid subscriptions shall be paid in monthly, semi-annual or annual installments and processed by the app marketplace partner through which you originally acquired the subscription.",0
You will only have access to a paid subscription while it is active and subsisting.,0
"Should you fail to pay your subscription within 7 days after a due date, you will automatically downgrade to free use .",0
"The renewal subscription fees will continue to be billed to the payment method you provided through the marketplace, automatically until canceled.",0
You must cancel your subscription before it renews each billing period in order to avoid billing of the next subscription fee to the payment method you provided.,0
Refunds cannot be claimed for any partial-month subscription period.,0
You can modify or cancel your paid subscription only through the app marketplace where you originally acquired the subscription.,0
"To view, modify or cancel your subscription, you may be required to be authenticated under the same user id by the marketplace partner.",0
# 2.4.3.,0
Refunds,0
"Please note that if you purchase a subscription through the apple itunes store or our iphone application, the sale is final, and we will not provide a refund.",0
"Your purchase will be subject to apple s applicable payment policy, which also may not provide for refunds.",0
"If you purchase a subscription through the google play store, the sale is final and we will not provide a refund.",0
"Your purchase will be subject to google s applicable payment policy, which also may not provide for refunds.",0
# 2.5.,0
Device requirements,0
"To enjoy replika via your smartphone or other device, your device must satisfy certain system requirements.",0
These requirements can be found on the website and the google and apple app marketplaces.,0
# 3.,0
Cancellation of services,0
# 3.1.,0
Cancellation by you,0
You may cancel your membership at any time by deleting your account in the app.,1
This action is irreversible.,1
"As soon as you delete your account, all the data associated with your use of the services will be removed permanently.",1
"Upon your account deletion, cancellation of a paid subscription is effective at the end of the applicable billing period.",0
You may cancel a paid subscription and downgrade to free use at any time without deleting your account.,0
Cancellation is effective at the end of the applicable billing period.,0
"Please note that if you purchase a paid subscription through the apple itunes store or our iphone application, you may cancel your subscription by canceling automatic renewal of paid in app subscriptions by selecting manage app subscriptions in your itunes account settings and selecting the subscription you want to modify.",0
"If you purchase a paid subscription through the google play store you may cancel automatic renewals in account settings under subscriptions in the google play app, or according to the current process outlined by google play.",0
# 3.2.,0
Cancellation by us,0
We may suspend or terminate your use of the services as a result of your fraud or breach of any obligation under these terms.,1
Such termination or suspension may be immediate and without notice.,0
# 4.,0
General practices regarding use and storage,0
"You acknowledge that we may establish general practices and limits concerning use of the services, including without limitation the maximum period of time that data or other content will be retained by the services and the maximum storage space that will be allotted on our servers on your behalf.",0
You agree that replika has no responsibility or liability for the deletion or failure to store any data or other content maintained or uploaded by the services.,0
You acknowledge that we reserve the right to terminate accounts that are inactive for an extended period of time.,0
"You further acknowledge that we reserve the right to change these general practices and limits at any time, in its sole discretion, with or without notice.",0
# 5.,0
Mobile services,0
"Some of our services are available via a mobile device, including (i) the ability to upload content to the services via a mobile device, (ii) the ability to browse the services and the website from a mobile device and (iii) the ability to access certain features through an application downloaded and installed on a mobile device (collectively, the mobile services ).",0
"To the extent you access the services through a mobile device, your wireless service carrier s standard charges, data rates, and other fees may apply.",0
"In addition, downloading, installing, or using certain mobile services may be prohibited or restricted by your carrier, and not all mobile services may work with all carriers or devices.",0
"By using the mobile services, you agree that we may communicate with you regarding replika and other entities by sms, mms, text message or other electronic means to your mobile device and that certain information about your usage of the mobile services may be communicated to us.",0
"In the event you change or deactivate your mobile telephone number, you agree to promptly update your replika account information to ensure that your messages are not sent to the person that acquires your old number.",0
# 6.,0
Conditions of use,0
# 6.1.,0
User conduct,0
"You are solely responsible for all code, video, images, information, data, text, software, music, sound, photographs, graphics, messages or other materials ( content ) that you upload, post, publish or display (hereinafter, upload ) or email or otherwise use via the services.",0
The following are examples of the kind of content and/or use that is illegal or prohibited by replika.,0
"We reserve the right to investigate and take appropriate legal action against anyone who, in our sole discretion, violates this provision, including without limitation, removing the offending content from the services, suspending or terminating the account of such violators and reporting you to the law enforcement authorities.",0
You agree to not use the services to:,0
Email or otherwise upload any content that (i) infringes any intellectual property or other proprietary rights of any party.,0
(ii) you do not have a right to upload under any law or under contractual or fiduciary relationships.,0
"(iii) contains software viruses or any other computer code, files or programs designed to interrupt, destroy or limit the functionality of any computer software or hardware or telecommunications equipment.",0
(iv) poses or creates a privacy or security risk to any person.,0
"(v) constitutes unsolicited or unauthorized advertising, promotional materials, commercial activities and/or sales, junk mail, spam, chain letters, pyramid schemes, contests, sweepstakes, or any other form of solicitation.",1
"(vi) is unlawful, harmful, threatening, abusive, harassing, tortious, excessively violent, defamatory, vulgar, obscene, pornographic, libelous, invasive of another s privacy, hateful racially, ethnically or otherwise objectionable.",0
"Or (vii) in the sole judgment of replika, is objectionable or which restricts or inhibits any other person from using or enjoying the services, or which may expose replika or its users to any harm or liability of any type",0
"Interfere with or disrupt the services or servers or networks connected to the services, or disobey any requirements, procedures, policies or regulations of networks connected to the services.",0
Or,0
"Violate any applicable local, state, national or international law, or any regulations having the force of law",0
"Impersonate any person or entity, or falsely state or otherwise misrepresent your affiliation with a person or entity",0
Solicit personal information from anyone under the age of 18,0
Harvest or collect email addresses or other contact information of other users from the services by electronic or other means for the purposes of sending unsolicited emails or other unsolicited communications,0
Advertise or offer to sell or buy any goods or services for any business purpose that is not specifically authorized,0
Further or promote any criminal activity or enterprise or provide instructional information about illegal activities.,0
Or,0
Obtain or attempt to access or otherwise obtain any materials or information through any means not intentionally made available or provided for through the services.,0
# 6.2.,0
Special notice for international use.,0
Export controls,0
"Software (defined below) available in connection with the services and the transmission of applicable data, if any, is subject to united states export controls.",0
No software may be downloaded from the services or otherwise exported or re-exported in violation of u.s.,0
Export laws.,0
Downloading or using the software is at your sole risk.,0
"Recognizing the global nature of the internet, you agree to comply with all local rules and laws regarding your use of the service, including as it concerns online conduct and acceptable content.",0
# 6.3.,0
Commercial use,0
The service is for your personal use only.,0
"Unless otherwise expressly authorized herein or in the services, you agree not to display, distribute, license, perform, publish, reproduce, duplicate, copy, create derivative works from, modify, sell, resell, exploit, transfer or upload for any commercial purposes, any portion of the services, use of the services, or access to the services.",0
# 6.4.,0
Use of replika by minors,0
"If you are under 13 years of age, you are not authorized to use the services, with or without registering.",0
"In addition, if you are under 18 years old, you may use the services, with or without registering, only with the approval of your parent or guardian.",0
# 7.,0
Apple app store and google play store legal information,0
"These terms apply to your use of all the services, including the iphone application available via the apple, inc.",0
"( apple ) app store (the applications ), and the android application available via the google, inc.",0
"( google ) play store (the applications ), but the following additional terms also apply to the applications:",0
"Both you and replika acknowledge that the terms are concluded between you and replika only, and not with apple and google, and that apple and google are not responsible for the application or the content",0
"The application is licensed to you on a limited, non-exclusive, non-transferrable, non-sublicensable basis, solely to be used in connection with the services for your private, personal, non-commercial use, subject to all the terms and conditions of this agreement as they are applicable to the services",0
You will only use the application in connection with an apple device that you own or control,0
You acknowledge and agree that apple has no obligation whatsoever to furnish any maintenance and support services with respect to the application,0
"In the event of any failure of the application to conform to any applicable warranty, including those implied by law, you may notify apple or google of such failure.",0
"Upon notification, apple and google s sole warranty obligation to you will be to refund to you the purchase price, if any, of the application",0
"You acknowledge and agree that replika, and not apple or google, is responsible for addressing any claims you or any third party may have in relation to the application",0
"You acknowledge and agree that in the event of any third party claim that the application or your possession and use of the application infringes that third party s intellectual property rights, replika, and not apple or google, will be responsible for the investigation, defense, settlement and discharge of any such infringement claim",0
You represent and warrant that you are not located in a country subject to a u.s.,0
"Government embargo, or that has been designated by the u.s.",0
Government as a terrorist supporting country and that you are not listed on any u.s.,0
Government list of prohibited or restricted parties,0
"Both you and replika acknowledge and agree that, in your use of the application, you will comply with any applicable third party terms of the agreement which may affect or be affected by such use.",0
And,0
"Both you and replika acknowledge and agree that apple and apple s subsidiaries and google and google s subsidiaries are third party beneficiaries of this agreement, and that upon your acceptance of this agreement, apple and google will have the right (and will be deemed to have accepted the right) to enforce this agreement against you as the third party beneficiary hereof.",0
"Replika and you acknowledge and agree that apple, and apple s subsidiaries, are third party beneficiaries of these terms of service with respect to the apple-enabled software, and that, upon your acceptance of the terms and conditions of these terms of service, apple will have the right (and will be deemed to have accepted the right) to enforce these terms of service against you with respect to the apple-enabled software as a third party beneficiary thereof.",0
# 8.,0
Intellectual property rights,0
# 8.1.,0
"Service content, software, and trademarks",0
"You acknowledge and agree that the services may contain content or features ( service content ) that are protected by copyright, patent, trademark, trade secret or other proprietary rights and laws.",0
"Except as expressly authorized by replika, you agree not to modify, copy, frame, scrape, rent, lease, loan, sell, distribute or create derivative works based on the services or the service content, in whole or in part, except that the foregoing does not apply to your own user content (as defined below) that you legally upload to the services.",0
"In connection with your use of the services, you will not engage in or use any data mining, robots, scraping or similar data gathering or extraction methods.",0
"If you are blocked by replika from accessing the services (including by blocking your ip address), you agree not to implement any measures to circumvent such blocking (e.g., by masking your ip address or using a proxy ip address).",0
Any use of the services or the service content other than as specifically authorized herein is strictly prohibited.,0
"The technology and software underlying the services or distributed in connection therewith are the property of replika, our affiliates and our partners (the software ).",0
"You agree not to copy, modify, create a derivative work of, reverse engineer, reverse assemble or otherwise attempt to discover any source code, sell, assign, sublicense, or otherwise transfer any right in the software.",0
Any rights not expressly granted herein are reserved by replika.,0
The replika name and logos are trademarks and service marks of replika (collectively the replika trademarks ).,0
"Other company, product, and service names and logos used and displayed via the services may be trademarks or service marks of their respective owners who may or may not endorse or be affiliated with or connected to replika.",0
"Nothing in these terms of service or the services should be construed as granting, by implication, estoppel, or otherwise, any license or right to use any of replika trademarks displayed on the services, without our prior written permission in each instance.",0
All goodwill generated from the use of replika trademarks will inure to our exclusive benefit.,0
# 8.2.,0
Third party material,0
"Under no circumstances will replika be liable in any way for any content or materials of any third parties (including users), including, but not limited to, for any errors or omissions in any content, or for any loss or damage of any kind incurred as a result of the use of any such content.",0
"You acknowledge that replika does not pre-screen content, but that replika and its designees will have the right (but not the obligation) in their sole discretion to refuse or remove any content that is available via the services.",0
"Without limiting the foregoing, replika and its designees will have the right to remove any content that violates these terms of service or is deemed by replika, in its sole discretion, to be otherwise objectionable.",0
"You agree that you must evaluate, and bear all risks associated with, the use of any content, including any reliance on the accuracy, completeness, or usefulness of such content.",0
# 8.3.,0
User content transmitted through the services,0
"With respect to the content or other materials you upload through the services or share with other users or recipients (collectively, user content ), you represent and warrant that you own all right, title and interest in and to such user content, including, without limitation, all copyrights and rights of publicity contained therein.",0
"By uploading any user content you hereby grant and will grant replika and its affiliated companies a nonexclusive, worldwide, royalty-free, fully paid up, transferable, sublicensable, perpetual, irrevocable license to copy, display, upload, perform, distribute, store, modify and otherwise use your user content in connection with the operation of the services or the promotion, advertising or marketing thereof in any form, medium or technology now known or later developed.",0
"You acknowledge and agree that any questions, comments, suggestions, ideas, feedback or other information about the services ( submissions ), provided by you to replika are non-confidential and replika will be entitled to the unrestricted use and dissemination of these submissions for any purpose, commercial or otherwise, without acknowledgment or compensation to you.",0
"You acknowledge and agree that replika may preserve content and may also disclose content if required to do so by law or in the good faith belief that such preservation or disclosure is reasonably necessary to: (a) comply with legal process, applicable laws or government requests.",0
(b) enforce these terms of service.,0
Respond to claims that any content violates the rights of third parties.,0
"Or (d) protect the rights, property, or personal safety of replika, our users and the public.",0
"You understand that the technical processing and transmission of the services, including your content, may involve (a) transmissions over various networks.",0
And (b) changes to conform and adapt to technical requirements of connecting networks or devices.,0
# 8.4.,0
Copyright complaints,0
"Replika respects the intellectual property of others, and we ask our users to do the same.",0
"If you believe that your work has been copied in a way that constitutes copyright infringement, or that your intellectual property rights have been otherwise violated, you should notify replika of your infringement claim in accordance with the procedure set forth below.",0
We will process and investigate notices of alleged infringement and will take appropriate actions under the digital millennium copyright act ( dmca ) and other applicable intellectual property laws with respect to any alleged or actual infringement.,0
A notification of claimed copyright infringement should be emailed to replika s copyright agent at copyright@replika.ai (subject line: dmca takedown request ).,0
You may also contact us by mail at:,0
Replika,0
1266 harrison st,0
"San francisco, ca 94103",0
United states,0
"To be effective, the notification must be in writing and contain the following information:",0
An electronic or physical signature of the person authorized to act on behalf of the owner of the copyright or other intellectual property interest,0
A description of the copyrighted work or other intellectual property that you claim has been infringed,0
"A description of where the material that you claim is infringing is located on the services, with enough detail that we may find it on the services",0
"Your address, telephone number, and email address",0
"A statement by you that you have a good faith belief that the disputed use is not authorized by the copyright or intellectual property owner, its agent, or the law",0
