text,highlighted
Toggle navigation your place on the web create account or sign in,0
Features,0
Opinions,0
Pricing,0
Advertising,0
Terms of service here is a non-binding summary of the legal text:,0
We provide wiki-based hosting of websites.,0
We respect your privacy.,0
Please respect copyright and licenses of materials you are going to use.,0
"Do not spam, we fight spam.",0
Do not vandalize.,0
Some content is not allowed.,0
See the prohibited usage list below!,0
"Basic functionality is free, there are fees for useful upgrades.",0
Free sites cannot be used to place any advertising.,0
We can terminate any account and block any site if there is any improper activity.,0
We do our best to keep wikidot.com online and error-free but do not guarantee anything.,0
Use at your own risk.,0
Introduction,0
"Welcome to wikidot.com - wiki hosting project that allows users to build web sites (""wikidot sites"", ""sites""), collaboratively edit content and communicate (""services"") under these terms of service (""terms"").",0
Wikidot is owned by wikidot inc.,1
"(""we"" or ""wikidot.com"") and located in poland.",1
Wikidot inc.,0
"Is incorporated in delaware, usa (division of corporations, file no.",0
"4326793), registered and operating in poland as wikidot inc.",0
S.a.,0
"Oddzia w polsce (krs: 0000294101), address: ul.",0
W.,0
"Okietka 5, 87100 toru , poland.",0
"By using the services by viewing or displaying or publishing (""posting"") any text, files, images, music, photos, video, sounds or any other work (""content"") to any of the wiki sites or using any other feature provided by the services, you agree to be bound by these terms of service and obey any applicable law.",0
The current version of the terms is always available at http://www.wikidot.com/legal:terms-of-service.,0
When new terms are published they apply immediately to all unregistered users of the services.,0
"Registered users will be presented with the changes, and the option of accepting the new terms, or canceling their account, at their next authenticated visit to the services.",0
"If you are a registered user and you choose to continue to use the services, you agree to be bound by the new terms.",0
Privacy,0
Some information is a subject to privacy policy which is a part of these terms.,0
We follow polish legislation for personal data management.,1
Content and use,0
By using the wikidot.com services you warrant that all the registration (and profile) information you submit is accurate and you will maintain the accuracy of such information and your use of services does not violate any applicable law or regulation.,0
Wikidot.com may delete content that in sole judgment of wikidot.com violates these terms.,1
We however assume no responsibility for monitoring any of the wiki sites for inappropriate content nor review any content before it is posted.,0
You as a wikidot.com user are solely responsible for the content you post through any of the services and any information or materials you transmit directly to other users.,0
By becoming an administrator of a wiki site (by creating a new wiki site or joining an existing one) you agree to control the content posted to the site and asure the site is not being used against these terms either by monitoring changes for improper use and acting accordingly or by setting strict permissions that allow content editing only to a limited number of users.,0
Copyrighted materials,0
Wikidot.com does not claim any copyrights to the content you post to the services.,0
"However by posting any content through the services to a public wikidot.com site, you hereby grant to wikidot.com a limited non-exclusive, fully-paid, royalty-free, sublicensable and worldwide license to use, modify, display and perform, reproduce and distribute the content solely on and through the services.",0
The license will terminate at the time the content is removed from the services.,0
This right is required for proper and legal operation of the services.,0
"The license does not allow us to do anything more that you would expect, e.g.",0
It does not give us the right to distribute your content outside wikidot services or sell your content to anyone.,0
"Although we might reuse content from public wikis in various places such as ""featured content"" or ""top wikis"", we will not disclose any content from non-public (private) sites to unauthorized users.",0
"Wikidot services contain content that is protected by various licenses, copyrights and trademarks (wikidot content).",0
"Wherever required, we grant you a limited, revocable and nonsublicensable license to reproduce and display wikidot content solely for your personal use in connection with using the services.",0
Prohibited content and usage,0
The following is a list of prohibited or illegal usage of the services.,0
"We reserve the right to investigate and take appropriate actions against anyone (in our sole discretion) violates these rules, including removing offending content and terminating the wikidot membership.",1
"Prohibited usage includes but is not limited to uploading, posting or otherwise making available or promote:",0
"Any content that is unlawful, harmful, threatening, abusive, harassing, tortuous, defamatory, vulgar, obscene, libelous, invasive of another's privacy, hateful, harm minors or racially, ethnically or otherwise objectionable,",0
"Pornography and ""adult content""",1
"Any content that contains nudity, violence, pornography, ""adult content"" or contains links to any other web site with such materials",0
Any information that you know is false or misleading,0
Any content that promotes illegal or fraudulent activities,0
Any content that you do not have a right to make publicly available or promotes the illegal use of any work without rights or license,0
"Any content that infringes any patent, trademark, trade secret, copyright or other proprietary rights of any party.",0
In particular it is not allowed to upload content that is not compatible with the particular wiki site content license,1
"Any ""junk"", ""spam"", ""chain letters,"" ""pyramid schemes"" etc.",1
"Any material that contains software viruses, spyware, malware or any other computer code, files or programs designed to interrupt, destroy or limit the functionality of any computer software or hardware or other electronic equipment, steal or collect private information",1
Any material that collects or contains personal information of other users for any unlawful purpose or without the user's permission,1
Any material that promotes pharmacy products (e.g.,0
"Viagra, cialis) and encourage users to visit online stores selling such products",0
"Any material that promotes financial products (such as loans, credit cards, bank accounts) and encourage users to visit websites offering such products",0
Any material that promote fraudulent services and misleads users to visit legally doubtful websites.,0
Other prohibited usage includes:,0
"Intentionally or unintentionally violating any applicable local, state, national or international law",0
"Collecting, storing or publishing available personal data about others without their acceptance",0
Advertising to (or soliciting of) users to buy or sell any product or services through direct communication provided by the services without their prior consent.,0
"This includes sending spam, junk messages or chain letters to other users via the private messages feature or any live connection",0
Covering or obscuring any of the advertisement boxes or toolbars via css style modification or any other technique,0
Covering or obscuring any elements of any of the page that impair its functionality.,0
"This also include the footer which contains links to wikidot.com main site, help pages, this terms, privacy policy, and problem reporting",0
Any automated use of the services that is not officially available.,0
"This includes reading, posting or changing any content, sending messages and any other such use.",0
This does not include rss feeds access,0
"Interfering with any part of the services, exploiting possible bugs or security holes",0
Mislead users by imitating any part of the services for collecting personal data or other unlawful purpose,0
"Using an identity (account, username, password) of another user or disclosing your own username or password to any third party or permitting any third party to access your account",0
Transferring your profile (includes selling) to any third party,0
Promoting objectionable content through the created sites (e.g.,0
"Pharmacy products, financial products)",0
"Massively promote particular wikidot sites on other sites and services (forums, blogs, news sites hosted by wikidot or other providers) for objectionable purposes (aka spamming)",0
"The use of custom css that hides, moves, covers, or otherwise interferes with the visibility, positioning and functionality of the top or bottom toolbar elements will be considered as prohibited usage.",0
"If you find any page that contains objectionable content please use ""flag as objectionable"" option at the bottom of each page.",0
Users can contact support@wikidot.com to make sure that their intended use of wikidot does not violate the terms.,0
Commercial usage,0
"You can use your wiki for any legal commercial purpose including ""business to business"" and ""business to consumer"" types of websites.",0
Advertising,0
"To compensate costs of hosting free sites, wikidot keeps exclusive right to use advertising space on web pages within free sites.",0
"Users of free sites are not allowed to place any other advertising to monetize their traffic, unless the site is upgraded to any of the paid plans.",0
Fees and upgrades,0
"Basic use of services is free of charge, but wikidot.com can charge users for additional features related to user account or site.",0
You acknowledge that wikidot reserves the right to change the fees any time,1
You also acknowledge that if we terminate your account because of violating these terms you will not be entitled to the refund of any unused portion of the fee.,0
By selecting a premium service you agree to pay wikidot inc.,0
The monthly or annual subscription fees indicated for that service.,0
Payments will be charged on the day you sign up for a service (pre-paid) and will cover the use of that service for a specified period.,0
Subscribers to premium services shall have thirty (30) days from the date of subscription to cancel their subscription for a full refund.,0
"After this thirty (30) day period, purchases are final not refundable except in our sole and absolute discretion.",0
The current paid service offer is presented at http://www.wikidot.com/plans.,0
We reserve the right to change the pricing and plans.,0
Especially we can change the prices to adjust to the changing currency exchange ratios.,0
For each purchase wikidot inc.,0
Will issue a valid vat invoice as directed by council directive 2001/115/ec of 20 december 2001 and applicable polish tax law.,0
"Vat tax of 23% is added to all purchases at wikidot.com for customers from european union unless they qualify for reverse charge by providing a valid eu vat id, as directed by council directive 2006/112/ec and applicable polish tax law.",0
Customers that do qualify for reverse charge are responsible for accounting such purchases according to their national tax rules.,0
Customers from outside european union are not charged vat.,0
"Falsification of information to evade payment of vat may result in immediate service termination, fines and/or criminal prosecution.",0
Copyright policy,0
"Each of the wiki sites can choose individual license (""site license"") for content (feature available only if allowed by subscription plans).",0
By posting content to any of the wiki sites you agree to follow this site license and make the content you author available under this license.,0
If your content does not follow the site license it must be clearly stated.,0
"You are not allowed to post, modify, distribute or reproduce any copyrighted material, trademarks or other proprietary information that belongs to others without having permission or appropriate license or if its license is incompatible with the site license.",0
Wikidot.com may terminate any user account and remove any unauthorized material from any the wiki site.,0
We also reserve the right to remove any wiki site that repeatedly contains illegal materials.,0
If you believe your copyrighted work has been posted on any of the wiki sites without your permission and against the license under which it is distributed - please contact us via email: copyright@wikidot.com.,0
Termination and blocking,0
"Wikidot reserves the right, without notice and in its sole discretion, to terminate your license to use the services and to block or prevent your access to and use of the service.",0
We also reserve the right to block any ip address from accessing or modyfying any or all parts of the service.,0
In addition any user or ip address (when acting anonymously) can be blocked by administrators of individual sites preventing such a user from participating and changing the site and posting content.,0
"We reserve the right to delete any wiki that has been created for testing purposes only without any significant content, recent activity and with clear signs of being abandoned.",0
Users can also delete their wikidot accounts by themselves.,0
Disclaimers,0
Wikidot.com is not responsible for any incorrect or inaccurate content posted on any of the wiki sites or through any other part of the services.,0
Wikidot.com is not responsible for links to other websites that may be contained in wiki sites nor content of linked websites.,0
Wikidot takes no responsibility of advertisements posted by third parties through the service nor any items or services offered by the advertiser.,0
"The services are provided ""as is"".",0
You are using wikidot services at your own risk.,0
"Although we work hard to keep the services online and working, we take no responsibility for possible errors, damages, lost content, malfunction",0
"Except in those jurisdictions which do not allow the exclusion of certain warranties, wikidot expressly disclaims all warranties of any kind and shall not be liable for any damages or losses whether directly or indirectly related to your use of this site or its content.",0
This limitation of liability shall apply to the maximum extent permitted by law.,0
Legal disputes,0
"You agree to indemnify wikidot, its owners, employees, and users from any liability relating to your use of the services.",0
"You agree that any legal dispute involving wikidot services shall be governed by the laws of poland and be subject to the jurisdiction of courts in toru , poland.",1
History,0
Official wikidot blog,0
Community,0
Documentation,0
About wikidot,0
Gift shop,0
Terms of service,0
"Privacy policy copyright all rights reserved, wikidot inc.",0
2021 click here to edit contents of this page.,0
Click here to toggle editing of individual sections of the page (if possible).,0
"Watch headings for an ""edit"" link when available.",0
Append content without editing the whole page source.,0
Check out how this page has evolved in the past.,0
If you want to discuss contents of this page - this is the easiest way to do it.,0
View and manage file attachments for this page.,0
A few useful tools to manage this site.,0
See pages that link to and include this page.,0
"Change the name (also url address, possibly the category) of the page.",0
View wiki source for this page without editing.,0
View/set parent page (used for creating breadcrumbs and structured layout).,0
