text,highlighted
Email address password your store name create your store opens in a new window shopify uses cookies to provide necessary site functionality and improve your experience.,0
"By using our website, you agree to our privacy policy and our cookie policy .",0
Ok skip to content shopify,0
Start,0
Start your business,0
Branding look professional and help customers connect with your business,0
Business name generator,0
"Online presence find a domain, explore stock images, and amplify your brand",0
Web address,0
Stock photography,0
Store set up use shopify s powerful features to start selling,0
Products to sell,0
Store themes,0
Sell,0
Sell everywhere,0
Online store sell online with an ecommerce website,0
Overview,0
Features,0
Examples,0
Themes,0
"Point of sale sell at retail locations, pop-ups, and beyond",0
Overview,0
Hardware,0
Features,0
Buy button transform an existing website or blog into an online store,0
Overview,0
"Checkout provide fast, smooth checkout experiences",0
Overview,0
Sales channels reach millions of shoppers and boost sales,0
Overview,0
Facebook and instagram,0
Walmart marketplace,0
Ebay,0
Amazon,0
Custom storefront tools stand out with custom commerce,0
Overview,0
Market,0
Market your business,0
Email marketing,0
Shopify ping,0
Google,0
Facebook ads,0
Manage,0
Manage everything,0
Payments,0
Shipping,0
Capital,0
Log in,0
Pricing,0
Learn,0
Help center,0
Blog,0
Business courses,0
Guides,0
Forums,0
Free tools,0
Podcasts,0
Business encyclopedia,0
Log in,0
Open main navigation home close main navigation,0
Start,0
Start your business,0
Branding look professional and help customers connect with your business,0
Business name generator,0
"Online presence find a domain, explore stock images, and amplify your brand",0
Web address,0
Stock photography,0
Store set up use shopify s powerful features to start selling,0
Products to sell,0
Store themes,0
Sell,0
Sell everywhere,0
Online store sell online with an ecommerce website,0
Overview,0
Features,0
Examples,0
Themes,0
"Point of sale sell at retail locations, pop-ups, and beyond",0
Overview,0
Hardware,0
Features,0
Buy button transform an existing website or blog into an online store,0
Overview,0
"Checkout provide fast, smooth checkout experiences",0
Overview,0
Sales channels reach millions of shoppers and boost sales,0
Overview,0
Facebook and instagram,0
Walmart marketplace,0
Ebay,0
Amazon,0
Custom storefront tools stand out with custom commerce,0
Overview,0
Market,0
Market your business,0
Email marketing,0
Shopify ping,0
Google,0
Facebook ads,0
Manage,0
Manage everything,0
Payments,0
Shipping,0
Capital,0
Pricing,0
Learn,0
Help center,0
Blog,0
Business courses,0
Guides,0
Forums,0
Free tools,0
Podcasts,0
Business encyclopedia,0
Log in,0
About,0
Careers,0
Press and media,0
Shopify plus,0
Sitemap,0
Opens in a new windowopens an external siteopens an external site in a new window shopify payments terms of service the terms and conditions described herein constitute a legal agreement,0
( agreement or shopify payments terms ) between you (if your business,0
Is a sole proprietorship) or your business (if you are signing up on,0
"Behalf of a corporation or other legal entity) (the merchant , you or",0
"Your ) and shopify payments (usa) inc., organized under the laws of",0
"Delaware with offices at 251 little falls drive, wilmington, delaware",0
"19808 ( shopify , we , us , or our )",0
A.,0
The shopify payments service,0
Our role,0
The shopify payments service ( shopify,0
Payments or the payments services ) is a: (i) payment account,0
Boarding.,0
(ii) payment underwriting.,0
"And, (iii) payment data",0
Transmission service that helps you integrate with a payment,0
"Processor (the processor ), as described more fully in this",0
Agreement.,1
The payments services may also apply to your use of,0
"Point-of-sale equipment ( pos equipment ), subject to",0
Availability and to your election to procure the same.,0
You,1
Hereby appoint us as your agent to deliver information and,0
Instructions on your behalf to the processor.,0
Under the separate shopify platform terms of,0
Service (the shopify,0
"Platform terms ), shopify inc.",0
Provides you with its online,0
"Storefront, shopping cart, store management, marketing, and",0
"Other services (collectively, the shopify platform services ).",0
The shopify platform terms are incorporated herein by reference,0
And by accepting this agreement you are also accepting them.,0
Neither shopify inc.,0
Nor shopify payments (usa) inc.,0
Is a,0
"Bank, payment institution, or money services business, but are",0
"Instead, respectively, a supplier of the shopify platform",0
Services supplied under the shopify platform terms and of the,0
Payments services under this agreement.,0
The processor,0
"The processor is stripe, inc., organized under the laws of",0
"California, which is a technical",0
Services provider and may offer the services as an agent of one,0
"Or more financial institutions in united states (each, a financial",0
Services provider ).,0
The processing and settlement of,0
Transactions (as defined below) ( payment processing ) is,0
Carried out by the processor and any of the financial services,0
Providers under a separate stripe connected account,0
"Agreement,",0
Including the united states stripe services,0
Agreement and the applicable,0
"Financial services terms, and",0
To the extent you use a payment method that is subject to,0
"Additional terms, the payment",0
"Terms (collectively,",0
The processor terms ).,0
"By accepting this agreement, you are",0
"Also accepting and agreeing to be bound by the processor terms,",0
Which is the legal agreement between you and the processor.,0
Shopify is not a party to the processor terms and is not liable,0
To you in respect thereof.,0
By accepting this agreement and the,0
Processor terms you are agreeing to the creation of an account,0
With the processor for payment processing (the processor,0
Account ).,0
"We reserve the right to change the processor, subject",0
To the terms of our agreement with the processor.,0
In the event,0
Of any inconsistency between this agreement and the processor,0
"Terms, this agreement shall prevail, except in the event of any",0
Inconsistency between this agreement and the processor terms,0
"Concerning payment processing or the processor account, in which",0
Case the processor terms shall prevail.,0
"The processor s role is to accept and process credit card, debit",0
Card and other types of payments (collectively cards ) with,0
Respect to sales of your products and services through,0
"Internet-based transactions ( card not present transactions"" or",0
Cnp transactions ).,0
"If applicable, pos equipment permits",0
"Transmission of data to the processor from in-person,",0
"Point-of-sale transactions ( card present transactions"" or cp",0
"Transactions ), as well as manually entered transactions ( keyed",0
Transactions ).,0
"Cnp transactions, cp transactions and keyed",0
"Transactions shall be referred to herein, collectively, as",0
Transactions .,0
Your role,0
"To utilize the services, you must be a business located in",0
United states.,1
The payments services,0
Shopify hereby grants you a,0
"Non-exclusive, non-transferable, non-sublicensable, limited,",0
Revocable right to use the payments services (the license ).,0
The license shall be for the term of this agreement only.,0
Neither the license nor any other provision hereof shall grant,0
Any rights in the payments services or other intellectual,0
Property rights except the limited license of use set out above.,0
You shall not: (i) permit any third party to access the payments,0
"Services, including, but not limited to, your shopify admin on",0
"Our website (the shopify admin ), except as permitted herein,",0
And to carry out transactions.,0
(ii) create derivate works based,0
On the payments services.,0
"(iii) copy, frame or mirror any part",0
"Of the content of the payments services, other than copying or",0
Framing for your internal business purposes.,0
(iv) reverse,0
"Engineer, disassemble, decompile, or otherwise attempt to",0
Discover the source code or trade secrets for any of the,0
Payments services.,0
"Or, (v) access the payments services in order",0
To build a competitive product or service.,0
It is your responsibility to obtain your customers consent to,0
"Be billed for each transaction or, as the case may be, on a",0
"Recurring basis, in compliance with applicable legal",0
"Requirements and visa europe ltd., visa u.s.a., inc., visa",0
Canada inc.,0
"And visa international (collectively, visa ),",0
"Mastercard international incorporated ( mastercard ), american",0
"Express or other applicable card networks (such networks being,",0
"Collectively, the payment networks ) payment rules (the",0
Payment network rules ).,0
Pos equipment,0
"If applicable, you may elect to purchase",0
Pos equipment from shopify that will allow you to accept cp,0
Transactions and keyed transactions.,0
Pos hardware may be,0
Purchased on the shopify hardware store located here:,0
Www.shopify.com/pos/hardware,0
(the pos equipment store ).,0
Pos software may be downloaded for,0
Ios devices from the apple app store under the title shopify,0
Pos or shopify .,0
Your use of the shopify pos hardware and,0
Software is subject to the applicable sections of the shopify,0
Platform terms of service.,0
Payment methods,0
The payments services support most,0
"Payment network cards, including credit, debit, pre-paid, or",0
Gift cards.,0
You assume sole and exclusive responsibility for the,0
Use of the payments services.,0
You also assume sole and exclusive,0
Responsibility for transactions under the processor terms.,0
You,1
Are solely responsible for verifying the identity of customers,0
And of the eligibility of a presented card used to purchase your,0
"Products and services, and shopify does not guarantee or assume",0
Any liability for transactions authorized and completed that may,0
Later be reversed or charged back (see section d5 below).,0
You,1
Are solely responsible for all reversed or charged back,0
"Transactions regardless of the reason for, or timing of the",0
Reversal or chargeback.,0
Shopify or the processor may add or,0
"Remove one or more types of payment networks or cards, in their",0
"Sole discretion, at any time, without prior notice to you.",0
Customer service,0
Shopify will use its commercially,1
Reasonable efforts to provide you with customer support to help,1
Resolve issues relating to the payments services.,1
The processor,0
Retains sole and exclusive responsibility for payment processing,0
"Of transactions, including the settlement of funds, but shopify",0
Will provide reasonable assistance in liaising between you and,0
The processor concerning the payment processing services.,0
You,1
Assume sole and exclusive responsibility for providing customer,0
Service or support to your customers for any and all issues,0
"Related to your products and services, including, but not",0
"Limited to, issues arising from the processing of cards through",0
The payments services.,0
Taxes,0
You have sole and exclusive responsibility to,0
"Determine what, if any, taxes apply to the sale of your goods",0
And services and/or the payments you receive in connection with,0
"Your use of the payments services (""taxes"").",0
It is solely your,0
"Responsibility to assess, collect, report, or remit the correct",0
"Taxes to the proper tax authority, whether in customers",0
"Jurisdictions, your jurisdiction or elsewhere.",0
We are not,0
"Obligated to, nor will we, determine whether taxes apply, or",0
"Calculate, collect, report, or remit any taxes to any tax",0
"Authority, arising from any transaction.",0
Shopify retains the,0
"Right, but not the obligation, at its sole discretion, to",0
Complete and file tax or related reports with tax authorities,0
Regarding transactions in those jurisdictions where shopify,0
Deems such reporting necessary.,0
You hereby indemnify and hold,0
Shopify harmless from and against any and all liability related,0
To taxes and filings made by shopify in respect thereof.,0
You,1
Agree that we may send you any tax-related information,0
Electronically.,0
Your customers,0
"If prohibited by law, you will not impose",0
Any fee or surcharge on a customer that seeks to use an eligible,0
Card.,0
You will provide an informational slip or receipt to your,0
Customer at the conclusion of the transaction that includes all,0
Information required under payment network rules and applicable,0
Law.,0
Security,0
We maintain commercially reasonable,0
"Administrative, technical and physical procedures to protect all",0
The personal information regarding you and your customers that,0
"Is stored in our servers from unauthorized access, accidental",0
"Loss, or modification.",0
"Shopify cannot, however, guarantee that",0
Unauthorized third parties will never be able to defeat those,0
Measures or use such personal information for improper purposes.,0
Data security,0
You assume full responsibility for the,0
Security of data on your website or otherwise in your possession,0
Or control.,0
You agree to comply with all applicable laws and,0
"Rules in connection with your collection, security, and",0
"Dissemination of any personal, financial, card, or transaction",0
"Information (collectively, data"", and as pertains to your",0
"Customers, cardholder data ).",0
You agree that at all times you,0
Shall be compliant with applicable payment card industry data,0
"Security standards ( pci-dss ) and, as applicable, the payment",0
Application data security standards ( pa-dss ).,0
You agree to,0
Promptly provide shopify with documentation evidencing your,0
Compliance with pci-dss and/or pa-dss upon request.,0
You also,0
Agree that you will use only pci-dss and pa-dss compliant,0
Service providers in connection with the storage or transmission,0
"Of card information, including a cardholder s account number,",0
"Expiration date, and cvv2.",0
You must not store cvv2 data at any,0
Time.,0
Information on pci-dss can be found on the pci council s,0
Website.,0
It is your,0
Responsibility to comply with these standards and all the,0
Payment network rules.,0
Audit right,0
"If shopify believes that a security breach,",0
"Personal data breach, or other compromise of data may have",0
"Occurred, shopify may require you to have a third-party auditor",0
That is approved by shopify conduct a security audit of your,0
Systems and facilities and issue a report to be provided to,0
"Shopify and, at shopify s discretion, to the processor, its",0
"Financial services provider, payment networks, and law",0
"Enforcement, at your sole cost and expense.",0
Privacy,0
Your privacy and the protection of your data,0
Are very important to us.,0
You acknowledge that you have,0
"Received, read in full, and agree with the terms of our privacy",0
"Policy, our data",0
"Processing addendum, and the",0
Processor s privacy policy.,0
Our privacy policy and data processing addendum are hereby,0
Incorporated into this agreement.,0
Shopify s privacy policy and,0
The processor s privacy policy contain important information,0
"About the collection, use, retention, and disclosure of personal",0
"Information, as well as other important matters, and explains",0
"How and for what purposes we and the processor collect, use,",0
"Retain, disclose and safeguard the information you provide to",0
Us.,0
You agree that shopify s privacy policy and the processor s,0
Privacy policy may be modified at shopify s or the processor s,0
"Option, if necessary, and you will check each privacy policy on",0
A regular basis.,0
You also acknowledge that the processor is,0
Required to report your business name and the name of your,0
Principals to the member alert to control high-risk merchants,0
List of mastercard ( match list ) maintained by mastercard and,0
"Accessed and updated by american express, to the vmas database",0
"Upheld by visa europe, and/or to the consortium merchant",0
"Negative file maintained by discover, if applicable, pursuant to",0
The requirements of the payment network rules.,0
"Additionally, you",0
"Agree that shopify s collection, use, retention, and disclosure",0
Of personal information is subject to our data processing,0
Addendum.,0
We will at all times comply with the provisions of applicable,0
"Data protection law, including the eu general data protection",0
"Regulation ( gdpr ), as applicable.",0
If we process any of your,0
Personal data when performing our obligations under this,0
"Agreement, we will do so as a data controller , as defined by",0
The gdpr.,0
"If we process any cardholder data on your behalf, we",0
And you both agree that it is our intention that you shall be,0
The data controller and we shall be the data processor in,0
"Relation to that data, as those terms are defined in the gdpr.",0
We shall process the personal data only in accordance with the,0
Terms of this agreement and any lawful instructions reasonably,0
Given by you to us from time to time.,0
"Additionally, you",0
"Acknowledge that the processor and maxmind, a fraud detection",0
"Service, each independently serve as data controllers with",0
Regards to any personal data that they may processes under this,0
Agreement and that we are not responsible for how they process,0
Such data.,0
Maxmind s privacy policy may be found here:,0
Www.maxmind.com/en/privacy-policy.,0
We will notify you (within a reasonable time frame) if we,0
"Receive a request from a person to have access to, or to erase",0
"That person s personal data, a complaint or request relating to",0
"Your obligations under applicable data protection legislation,",0
Or any other communication relating directly to the processing,0
Of any personal data in connection with this agreement.,0
You,1
Acknowledge that such requests may be subject to independent,0
"Legal retention or confidentiality requirements, as permitted by",0
The gdpr.,0
We will provide you with reasonable co-operation and assistance,0
In relation to any complaint or request made in respect of any,0
"Personal data processed by us on your behalf, including by",0
"Providing you with details of the complaint or request, helping",0
You to comply with any data subject access requests (within the,0
Relevant timescales set out in applicable data protection,0
"Legislation), and providing you with any personal data we hold",0
"In relation to a person making a complaint or request (again,",0
Within a reasonable timescale).,0
You acknowledge that we are relying on you for direction as to,0
The extent to which we are entitled to use and process the,0
Personal data in the cardholder data that you provide us with.,0
"Consequently, we will not be liable for any claim brought by a",0
"Data subject arising from any action or omission by us, to the",0
Extent that such action or omission resulted from your,0
Instruction.,0
You consent to the exchange of your information between the,0
Account you have established through the shopify platform,0
Services and the payments services established under this,0
Agreement.,1
Shopify will commingle such accounts and refers to,0
Them together in this agreement as the shopify payments,0
Account .,0
"Where a data subject is located in the european economic area,",1
That data subject s personal data will be processed by shopify,1
"International limited, in accordance with our privacy policy.",1
As,1
"Part of providing the payments services, this personal data may",1
"Be transferred to other regions, including to canada and the",1
United states.,1
"Additionally, in order to process, use, record,",0
"And disclose your personal information, information related to",0
"Your business, and data, we or our agents may transfer such",0
"Information to and receive it from the processor, its financial",0
"Services provider, or their respective agents and, in so doing,",0
We may transmit or possess it outside of your jurisdiction.,0
"Additionally, in order to provide the payments services, we use",1
A variety of third party sub-processors that fall into many,1
"Broad categories for example, we use sub-processors to help us:",1
"(i) protect you and shopify from potentially risky transactions,",1
"Security threats, or fraud.",1
(ii) perform administrative tasks.,1
"(iii) deliver portions of the payments services (e.g., third",1
Parties that work with us to actually process credit card,1
Payments or conduct any shipping).,1
(iv) develop and improve our,1
Products and the payments services.,1
(v) generate analytics or,1
Other information relating to the payments services.,1
"And, (vi)",1
"Build our technical infrastructure (e.g., using cloud storage",1
Providers or information security vendors).,1
By using the,0
"Payments services, you consent to our use of sub-processors,",0
Which is described in more detail in our privacy,0
Policy.,0
Privacy of others,0
You represent to us that you are in,0
Compliance with all applicable privacy laws and that you,0
Maintain a publicly accessible privacy policy that accurately,0
"Discloses how you collect, use, and disclose personal data,",0
Including through the payments services.,0
"Additionally,",0
You,1
Represent to us that you have obtained all necessary rights and,1
Consents under applicable law to allow us and the processor to,1
"Collect, use, retain, and disclose any cardholder data that you",1
"Provide to, or authorize us to collect, including information",1
That we may collect directly from you of your customers via,1
Cookies or other means and to use that data to provide the,1
Payments services,1
"(e.g., to process transactions and to screen",0
For fraud or compliance purposes).,0
"Further, you represent that we will not be in breach of any such",0
"Laws by collecting, receiving, using, and disclosing such",0
Information in connection with the payments services as,0
Described in our privacy,0
Policy.,0
As between the,0
"Parties to this agreement, you are solely responsible for",0
Disclosing to your customers that we will collect and process,0
Their cardholder data in our supply of the payments services to,0
"You, and that in so doing we may transmit or possess it outside",0
"Of your or their jurisdiction, and that it may be subject to",0
Disclosure as required by applicable law.,0
"If you receive information about others, including cardholders",0
"And other customers, through the use of the payments services,",0
You must keep such information confidential and only use it in,0
Connection with the payments services or as otherwise permitted,0
By the subject of such information.,0
You may not disclose or distribute any such information to a,0
Third party or use any such information for marketing purposes,0
Unless you receive the express consent of the subject thereof to,0
Do so.,0
You may not disclose cardholder data to any third party,0
Other than in connection with processing a transaction requested,0
By your customer.,0
Restricted use,0
"You are required to obey all laws,",0
"Rules, and regulations applicable to your use of the payments",0
"Services (e.g., including those governing financial services,",0
"Consumer protections, unfair competition, anti-discrimination,",0
Or false advertising).,0
In addition to any other requirements or,0
"Restrictions set forth in this agreement, you shall not: (i)",0
Utilize the credit available on any card to provide cash,0
Advances to cardholders.,0
(ii) submit any transaction for,0
Processing that does not arise from your sale of goods or,0
Service to a customer.,0
(iii) act as a payment intermediary or,0
Aggregator or otherwise resell the payments services on behalf,0
Of any third party.,0
(iv) send what you believe to be potentially,0
Fraudulent authorizations or fraudulent transactions.,0
"Or, (v)",0
Use the payments services or the payment processing services in,0
A manner that a payment network reasonably believes to be an,0
Abuse of the payment network or a violation of the payment,0
Network rules.,0
You further agree not to permit any third party to do any of the,1
"Following: (i) access or attempt to access our systems,",1
"Programs, or data that are not made available for public use.",1
"(ii) copy, reproduce, republish, upload, post, transmit, resell,",0
"Or distribute, in any way, material from us.",0
(iii) permit any,0
Third party to use and benefit from the payments services via a,0
"Rental, lease, timesharing, service bureau, or other",0
Arrangement.,0
(iv) transfer any rights granted to you under this,0
Agreement.,1
(v) work around any of the technical limitations of,0
"The payments services, use any tool to enable features or",0
Functionalities that are otherwise disabled in the payments,0
"Services, or decompile, disassemble, or otherwise reverse",0
"Engineer the payments services, except to the extent that such",0
Restriction is expressly prohibited by law.,0
(vi) perform or,0
Attempt to perform any actions that would interfere with the,0
"Proper working of the payments services, prevent access to or",0
"Use of the payments services by our other users, or impose an",0
Unreasonable or disproportionately large load on our,0
Infrastructure.,0
"Or, (vii) otherwise use the payments services",0
Except as expressly allowed under this section.,0
Suspicion of unauthorized or illegal use,0
We reserve the,0
Right to not provide the payments services in respect of any,0
"Transaction you submit that we believe, in our sole discretion,",0
"Is in violation of this agreement, any other shopify or",0
"Processor agreement, or exposes you, shopify, the processor, or",0
"Any other third party to actual or potential risk or harm,",0
"Including, but not limited to, fraud and other criminal acts.",0
You are hereby granting us authorization to share information,0
"With law enforcement about you, your transactions, or your",0
Shopify payments account.,0
Payment network rules,0
The payment networks have,1
"Established guidelines, bylaws, rules, and regulations in the",1
Form of the payment network rules.,1
