text,highlighted
You are required to comply,1
With all applicable payment network rules.,1
The payment network,1
"Rules for visa, mastercard and american express are available on",1
The internet at the following links:,1
"Visa,",1
Mastercard,1
And american,1
Express.,1
The payment networks may amend the payment network rules at any,0
Time and without notice to us or to you.,0
Insofar as the terms of,0
This agreement and/or the processor terms are inconsistent with,0
"The payment network rules, the payment network rules shall",0
Prevail.,0
We reserve the right to amend this agreement at any,0
"Time, with notice to you, as may be necessary to comply with the",0
Payment network rules.,0
Disclosures and notices,0
You agree that shopify can,0
"Provide disclosures and notices, including tax forms, that we",0
Deem appropriate regarding the payments services to you by,0
"Posting such disclosures and notices in your shopify admin,",0
Emailing them to the email address listed in your shopify,0
"Account, or mailing them to the address listed in your shopify",0
Account.,0
You also agree that electronic disclosures and notices,0
Have the same meaning and effect as if we had provided you with,0
A paper copy.,0
Such disclosures and notices shall be considered,0
To be received by you within twenty-four (24) hours of the time,0
"It is posted to your shopify admin or emailed to you, unless we",0
Receive notice that the email was not delivered.,0
Automatic reminders,0
We may use automated telephone,0
"Dialing, text messaging systems, and email to provide messages",0
To you about your shopify payments account.,0
The telephone,0
Messages may be played by a machine automatically when the,0
"Telephone is answered, whether answered by you or another party.",0
These messages may also be recorded by your answering machine or,0
Voicemail.,0
You give us permission to call or send a text message,0
To any telephone number that you have given us and to play,0
Pre-recorded messages or send text messages with information,0
About this agreement or your account over the phone.,0
You agree,0
That we will not be liable to you for any such calls or,0
Electronic communications even if information is communicated to,0
An unintended recipient.,0
You understand that when you receive,0
Such calls or electronic communications you may incur a charge,0
"From the company that provides you with telecommunications,",0
Wireless and/or internet services.,0
You agree that we have no,0
Liability for such charges.,0
You agree to immediately notify us,0
If you change telephone numbers or are otherwise no longer the,0
Subscriber or customary user of a telephone number or email,0
Address you have previously provided to us.,0
B.,0
Getting a payments services account,0
Registration,0
The payments services are only made,0
Available to persons in united states that operate a business selling,0
Goods and services.,0
You may not use the payments services for,0
"Non-commercial, personal, family, or household purposes.",0
To use,0
"Shopify payments for your business, you are required to register",0
For a shopify payments account.,0
When you register for a shopify,0
"Payments account,",0
We will collect information such as your name,1
"(if you are a sole proprietor), your business or trade name,",1
"Your address, email, phone number, business identification or",1
"Registration number, and certain other information that we",1
Require.,1
We may also collect personal information (including,1
"Name, birthdate, and government-issued identification number)",1
About your beneficial owners or principals.,1
You may register as an individual (sole proprietor) or as a,0
Corporation or other legal entity.,0
If you register as a,0
"Corporation or other legal entity, you must be authorized to act",0
"On behalf of such entity, have the authority to bind the entity",0
"To this agreement, and you must agree to this agreement on",0
Behalf of such entity.,0
"If you have so agreed, the term",0
"""merchant"", you or your will mean you, the natural person",0
"Acting as a business, if you are a sole proprietor, or if you",0
"Have registered as a corporation or other legal entity, it will",0
Mean that entity.,0
You understand that by registering for a,0
"Shopify payments account, you are also registering for a",0
Processor account under the processor terms and that you are,0
Simultaneously providing your information to shopify for the,0
"Purpose of opening a shopify payments account, and to the",0
Processor for the purpose of establishing your processor,0
Account.,0
Company descriptions and site url,0
As part of your,0
"Registration, you must provide the name under which you do",0
"Business (which may be the business legal name or a ""doing",0
"Business name"") (e.g.",0
Mystore online widgets) and a billing,0
Descriptor.,0
These two fields and your site url may appear in your,0
Customers credit or debit card statements.,0
To avoid customer,0
Confusion and transaction disputes it is important that you,0
Enter a description that clearly identifies your business.,0
You,1
"Hereby agree to indemnify us from any costs, liabilities,",0
"Losses, or expenses from disputes due to your failure to do so.",0
Verification and underwriting,0
"To verify your identity,",0
"We may require additional information, including your company",0
"Registration number or business number, your hst, gst, or tax",0
"Number, and, if applicable, your date of birth.",0
We may also ask,0
For additional information to help verify your identity and,0
"Assess your business risk, including, but not limited, to",0
"Business invoices, reseller authorization or distributor",0
"Information, a driver s license or other government issued",0
"Identification, or business license, for you or for any of the",0
Owners or principals of your business.,0
We may ask you for your,0
Financial statements.,0
We may request your permission to do a,0
Physical inspection at your place of business and to examine,0
Books and records that pertain to your compliance with this,0
Agreement.,1
Your failure to comply with any of these requests,0
Within five (5) days may result in suspension or termination of,0
Your shopify payments account and the processor account.,0
You,1
Authorize us to retrieve additional information about you from,0
Third parties and other identification services.,0
We reserve the,0
Right to hold funds in your shopify payments account while,0
Awaiting the information requested above.,0
Shopify may use your,0
Information to apply for card merchant acquiring accounts on,0
Your behalf with certain payment networks (such as american,0
Express).,0
"After we have collected and verified all your information, we",0
Will review your account and determine if you are eligible to,0
Use the payments services.,0
We will notify you once your shopify,0
Payments account has been either approved or deemed ineligible,0
For use of the payments services.,0
"By accepting the terms of this agreement, you are providing us",1
With authorization to retrieve information about you by using,1
"Third parties, including credit bureaus and other information",1
Providers.,1
You acknowledge that such information retrieved may,0
"Include your name, address history, credit history, and other",0
Data about you.,0
We may periodically update this information to,0
Determine whether you continue to meet the eligibility,0
Requirements for a shopify payments account.,0
You agree that shopify is permitted to contact and share,1
Information about you and your application (including whether,1
"You are approved or declined), your shopify payments account,",1
And the processor account with the processor and other third,1
Parties in order to perform the payments services.,1
This includes,1
Sharing information: (i) about transactions for regulatory or,1
Compliance purposes.,1
(ii) for use in connection with the,1
Management and maintenance of the payments services.,1
(iii) to,1
"Create and update our and their customer records about you, and",1
To assist us and them in better serving you.,1
"And, (iv) to",1
Conduct our and their risk management process.,1
Designated country,0
In registering for a shopify payments,0
"Account, you are obliged to identify the location from where you",0
Are operating the business that will use the payments services,0
In united states.,0
"By registering for a shopify payments account, you",0
Are confirming that you are either a legal resident of united states or,0
"You are duly established and, if necessary, registered or",0
Licensed as a business entity authorized to conduct business in,0
United states.,1
The payments services and shopify payments account may,0
Only be used in united states.,0
"By accepting this agreement, you confirm",0
That you will satisfy these requirements.,0
Prohibited businesses,0
The following categories of businesses and business practices,0
Are prohibited from using the payments services ( prohibited,0
Businesses ).,0
Prohibited business categories may be imposed by,0
"Law or through the payment network rules, by shopify or the",0
Requirements of the processor s financial services providers.,0
The types of businesses listed below are representative but not,0
Exhaustive.,0
If you are uncertain as to whether your business is,0
A prohibited business or have questions about how these,0
"Requirements apply to you, please contact",0
Us.,0
We may,0
Add to or update the prohibited business list at any time,0
Financial and professional services,0
Investment and credit services,0
Securities brokers.,0
Mortgage consulting or debt reduction,0
Services.,0
Credit counseling or repair.,0
Investment services.,0
Real,0
Estate opportunities.,0
Lending instruments,0
Money and legal services,0
"Financial institutions, money transmitters and money services",0
"Businesses, check cashing, wire transfers, money orders.",0
Currency,0
Exchanges or dealers.,0
Bill-pay services.,0
Crowdfunding.,0
Insurance.,0
Bail bonds.,0
Collections agencies.,0
Law firms collecting funds for,0
Any purpose other than to pay fees owed to the firm for services,0
"Provided by the firm (e.g., firms cannot use stripe to hold client",0
"Funds, collection or settlement amounts, disputed funds, etc.)",0
Virtual currency or stored value,0
"Virtual currency that can be monetized, resold, or converted to",0
Physical or digital products and services or otherwise exit the,0
"Virtual world (e.g., bitcoin).",0
Cryptocurrency mining equipment.,0
Initial coin offerings.,0
"Digital wallets, sale of stored value or",0
"Credits maintained, accepted and issued by anyone other than the",0
Seller,0
"Ip infringement,",0
Regulated or illegal products and services,1
Adult content and services,0
"Pornography and other obscene materials (including literature,",1
Imagery and other media) depicting nudity or explicitly sexual,1
Acts.,1
Sites offering any sexually-related services such as,1
"Prostitution, escorts, pay-per view, adult live chat features.",1
"Sexually oriented items (e.g., adult toys).",1
Adult video stores,1
And sexually oriented massage parlors.,1
"Gentleman s clubs, topless",1
"Bars, and strip clubs.",1
Sexually oriented dating services,1
Counterfeit or unauthorized goods,0
Counterfeit goods.,0
Unauthorized sale or resale of brand name or,0
Designer products or services.,0
Sale of goods or services that are,0
Illegally imported or exported,0
Gambling,0
Lotteries.,0
Bidding fee auctions.,0
Sports forecasting or odds making,0
For a monetary or material prize.,0
Fantasy sports leagues with cash,0
Prizes.,0
Internet gaming.,0
Contests.,0
Sweepstakes.,0
Games of chance,0
"Including legal or illegal forms of gambling, internet gambling,",0
Sweepstakes and contests with a buy-in or cash prize.,0
Charity,0
Sweepstakes and raffles for the explicit purpose of fundraising,0
Intellectual property or proprietary rights infringement,0
"Sales, distribution, or access to counterfeit music, movies,",0
"Software, or other licensed materials without the appropriate",0
Authorization from the rights holder.,0
Any product or service that,0
"Directly infringes or facilitates infringement upon the trademark,",0
"Patent, copyright, trade secrets, or proprietary or privacy rights",0
Of any third party.,0
Use of shopify intellectual property without,0
Express consent from shopify.,0
"Use of the shopify name or logo,",0
Including use of shopify trade or service marks inconsistent with,0
"The shopify trademark usage guidelines,",0
Or in a manner that otherwise harms shopify or the shopify brand.,0
Any action that implies an untrue endorsement by or affiliation with,0
Shopify,0
Regulated or illegal products or services,0
Cannabis dispensaries and related businesses.,0
"Sale of tobacco,",0
"E-cigarettes, and e-liquid.",0
Online pharmacies.,0
Prescription-only,0
Products including card-not-present pharmaceuticals.,0
Peptides and,0
Research chemicals.,0
Fake references or id-providing services.,0
Age,0
Restricted goods or services.,0
Weapons and munitions.,0
Gunpowder and,0
Other explosives.,0
Fireworks and related goods.,0
"Toxic, flammable,",0
And radioactive materials.,0
Products and services with varying,0
Legal status on a state-by-state basis.,0
"Goods or services, the",0
Sale of which is illegal under applicable law in the jurisdictions,0
To which your business is targeted or directed,0
Sanctions,0
Use of the payments services or use of shopify payments in or for,0
"The benefit of a country, organization, entity, or person embargoed",0
"Or blocked by any government, including any person/entity on",0
Government sanctions lists,0
Products or services that are otherwise prohibited by law or our financial partners,0
Aggregation,0
Engaging in any form of licensed or unlicensed aggregation of,0
"Funds owed to third parties, factoring, or other activities",0
Intended to obfuscate the origin of funds.,0
Payment facilitation,0
Drug paraphernalia,0
"Any equipment designed for making or using drugs, such as bongs,",0
"Vaporizers, and hookahs",0
High risk businesses,0
Bankruptcy lawyers.,0
Remote technical support.,0
Psychic services.,0
Essay mills.,0
Chain letters.,0
Door-to-door sales.,0
Medical benefit,0
Packages.,0
Telemedicine and telehealth services.,0
Travel reservation,0
Services and clubs.,0
Airlines.,0
Cruises.,0
Timeshares.,0
"Circumvention,",0
Jamming and interference devices.,0
"Prepaid phone cards, phone",0
Services.,0
"Telemarketing, offering substantial rebates or special",0
Incentives as an inducement to purchase products or services.,0
Telecommunications manipulation equipment.,0
Forwarding brokers.,0
Negative response marketing.,0
Subscriptions over one year.,0
Extended,0
Warranties.,0
Government grants.,0
"Embassy, foreign consulate, or",0
Other foreign governments.,0
Charities without proper registration.,0
Credit card and identity theft protection.,0
The use of credit to,0
Pay for lending services.,0
Any businesses that we believe poses,0
"Elevated financial risk, legal liability, or violates card network",0
Or bank policies.,0
Any business or organization that a.,0
"Engages in,",0
"Encourages, promotes or celebrates unlawful violence or physical",0
"Harm to persons or property, or b.",0
"Engages in, encourages,",0
Promotes or celebrates unlawful violence toward any group based on,0
"Race, religion, disability, gender, sexual orientation, national",0
"Origin, or any other immutable characteristic",0
Multi-level marketing,0
Pyramid schemes network marketing and referral marketing programs,0
Pseudo pharmaceuticals,0
"Nutraceuticals, pseudo-pharmaceuticals and other products that",0
Make health claims that have not been approved or verified by the,0
Applicable local and/or national regulatory body,0
Social media activity,0
"Sale of twitter followers, facebook likes, youtube views, instagram",0
"Followers, and other forms of social media activity",0
Substances designed to mimic illegal drugs,0
Sale of a legal substance that provides the same effect as an,0
"Illegal drug (e.g., salvia, kratom)",0
Use of shopify payments in a manner inconsistent with its intended use or as expressly prohibited in the processor terms,0
Use of shopify payments principally as a virtual terminal,0
"(e.g., submitting card transactions by manually inputting card",0
Information).,0
Processing where there is no bona fide good or,0
"Service sold, or donation accepted.",0
Card testing.,0
Evasion of,0
Card network chargeback monitoring programs.,0
Cross-border,0
Acquiring.,0
Sharing cardholder information with another,0
Merchant for payment cross-sell product or service,0
Video game or virtual world credits,0
Sale of in-game currency unless the merchant is the operator of the,0
Virtual world,0
"Unfair, predatory, or deceptive practices",0
Get rich quick schemes,0
Investment opportunities or other services that promise high rewards,0
Mug shot publication or pay-to-remove sites,0
Platforms that facilitate the publication and removal of content,0
"(such as mug shots), where the primary purpose of posting such",0
Content is to cause or raise concerns of reputational harm,0
No-value-added services,0
Sale or resale of a service without added benefit to the buyer.,0
Resale of government offerings without authorization or added value.,0
"Sites that we determine in our sole discretion to be unfair,",0
"Deceptive, or predatory towards consumers",0
C.,0
Processing card transactions and receiving your funds,0
Shopify payments fees,0
You agree to pay the fees for,0
"Processing that are set out in your shopify admin, which are",0
"Incorporated herein by reference (the ""processing fees"").",0
Processing fees shall be collected from you by the processor on,0
Our behalf in accordance with the terms of the stripe connected,0
Account,0
Agreement.,1
"If applicable, fees for pos equipment are posted here:",0
Www.shopify.com/pos/hardware,0
And here:,0
Www.shopify.com/pricing (the,0
Pos equipment fees ).,0
"At our discretion, pos equipment fees",0
Will be collected on our behalf by the processor pursuant to the,0
Processor terms or by such other means as we may prescribe from,0
Time to time.,0
Fees for shopify platform services are collected by shopify,0
Pursuant to the shopify platform terms of,0
"Service (the ""shopify",0
"Platform services fees"").",0
"Processing fees, equipment fees, and",0
Shopify platform services fees shall be referred to herein,0
"Collectively as the ""fees"".",0
"You are obligated to pay all applicable taxes, fees and other",0
"Charges imposed by any governmental authority, including,",0
"Without limitation, any value added tax, goods and services tax,",0
"Harmonized sales tax and/or provincial or territorial sales tax,",0
On the payments services provided under this agreement.,0
If you,0
"Are tax-exempt, you will provide us with an appropriate",0
Certificate or other evidence of tax exemption that is,0
Satisfactory to us.,0
"We reserve the right to change the fees at any time, subject to",0
A thirty (30) day notice period to you in accordance with,0
Section a18.,0
If you continue to use the payments services and,0
"The processor services for such thirty (30) days, then you are",0
Deemed to have accepted the change in fees contemplated by such,0
Notice.,0
"In addition to the fees, you are also responsible for any",0
"Penalties and fines imposed on you or on us by any bank, money",0
"Services business, payment network, financial institution, or",0
Other financial intermediary resulting from your use of the,0
Payments services in a manner not permitted by this agreement or,0
By such financial intermediary s rules and regulations.,0
Security interest,0
As security for performance of your,0
"Obligations under this agreement, you grant us a first priority",0
Lien and security interest on all funds processed and deposited,0
"Into all payout accounts (as defined in the processor terms),",0
And any other bank accounts associated with your shopify,0
"Payments account, and in any funds processed using the payment",0
Processing services.,0
These security interests and liens will,0
Secure payment and performance of all of your obligations under,0
This agreement and any other agreements now existing or later,0
"Entered into between us and you, including, without limitation,",0
Your obligation to pay any amounts due and owing to us.,0
You will,0
"Execute, deliver and pay the fees for any documents we request",0
"To create, perfect, maintain, and enforce this security",0
Interest.,0
Our collection rights,0
"To the extent permitted by law, we",0
May collect any obligations you owe us under this agreement by,0
Requesting that the processor deduct the corresponding amounts,0
From the reserve account (as that term is defined below) or from,0
Funds payable to you arising from the settlement of,0
Transactions.,0
Fees will be assessed at the time a transaction is,0
Processed and will be first deducted from the funds received for,0
Such transaction.,0
If these amounts are not sufficient to meet,0
"Your obligations to us, we may charge the payment method",0
Associated with your shopify payments account for any amounts,0
Owed to us.,0
Your failure to fully pay amounts that you owe us on,0
Demand will be a breach of this agreement.,0
You will be liable,0
For our costs associated with collection in addition to the,0
"Amount owed, including, without limitation, attorneys fees and",0
"Expenses, costs of any arbitration or court proceeding,",0
"Collection agency fees, and any applicable interest.",0
"Additionally, we may require a personal guarantee from a",0
Principal of a business for funds owed under this agreement.,0
If,1
We require a personal guarantee we will specifically inform you,0
In advance.,0
"In addition to the amount due, delinquent accounts may be",0
Charged with fees that are incidental to the collection of,0
"Delinquent accounts and chargebacks, including, but not limited",0
"To, collection fees and convenience fees and other third-party",0
Charges.,0
You hereby explicitly agree that all communication in relation,0
To delinquent accounts will be made by electronic mail or by,0
"Phone, as provided to shopify by you.",0
Such communication may be,0
"Made by shopify or by anyone on its behalf, including, but not",0
"Limited to, a third-party collection agent.",0
Reserves,0
Funds held in reserves are amounts of money set,0
"Aside to cover chargebacks, refunds, or other payment",0
"Obligations under this agreement (the ""reserve account"").",0
"We, in",0
"Our discretion, will set the terms of your reserve account and",0
"Notify you of such terms, which may require that a certain",0
Amount (including the full amount) of the funds received for a,0
"Transaction are held for a period of time, or that additional",0
Amounts are held in the reserve account.,0
"We, in our discretion,",0
May elect to change the terms of the reserve account at any,0
"Time, for any reason, based on your payment processing history",0
Or as requested by our payment processors.,0
We may require you to fund the reserve account by means of: (i),0
Any funds payouts made or due to you for transactions submitted,0
To the payments services.,0
"Or, (ii) amounts available in your",0
Bank account by means of ach debit to your shopify payments,0
Account.,0
"Or, (iv) other sources of funds associated with your",0
Shopify payments account.,0
"Or, (iv) requesting that you provide",0
Funds to us for deposit to the reserve account.,0
You agree that: (i) you are not entitled to any interest or,0
Other compensation associated with the funds held in the reserve,0
Account.,0
(ii) you have no right to direct that account.,0
(iii),0
You have no legal interest in those funds or that account.,0
"And,",0
(iv) you may not assign any interest in those funds or that,0
Account.,0
Contesting chargebacks,0
You or shopify may elect to,0
Contest chargebacks assessed to your account.,0
Shopify may,0
"Provide you with assistance, including notifications and",0
Software to help contest your chargebacks.,0
We do not assume any,0
Liability for our role or assistance in contesting chargebacks.,0
You grant us permission to share records or other information,0
"Required with the cardholder, the cardholder s financial",0
"Institution, and your financial institution to help resolve any",0
Chargeback.,0
You acknowledge that your failure to provide us with,0
Complete and accurate information in a timely manner may result,0
In an irreversible chargeback being assessed.,0
If the cardholder s issuing bank or the payment network does not,0
"Resolve a dispute in your favor, we may recover the chargeback",0
Amount and any associated fees from you as described in this,0
Agreement.,1
"We reserve the right, upon notice to you, to charge a fee for",0
Mediating or investigating chargeback disputes.,0
D.,0
Termination and other general legal terms,0
Term,0
The agreement is effective upon the date you agree,0
To it (by electronically indicating acceptance) and continues so,0
Long as you use the payments services or until terminated by you,0
Or by shopify.,0
Termination,0
You may terminate this agreement by closing,0
Your shopify payments account at any time by following the,0
Instructions in your shopify admin.,0
We may terminate this,1
"Agreement and close your shopify payments account at any time,",1
For any reason,1
", upon notice to you in accordance with section",0
A18 above.,0
We may suspend your shopify payments account and your,0
Access to the payments services and any rights in respect of,0
"Your shopify payments account, or terminate this agreement, at",0
"Any time, for any reason, including if: (i) we determine that",0
You may be ineligible for the payments services because of the,0
"Risk associated with your shopify payments account, including,",0
"Without limitation, significant credit or fraud risk, or for any",0
Other reason.,0
(ii) you do not comply with any of the provisions,0
Of this agreement or the processor terms.,0
"Or, (iii) upon request",0
"Of the payment network, the processor, or a card issuer.",0
