text,highlighted
"Cookie policywe use cookies or trackers to facilitate your browsing on the site and to compile statistics with the aim of improving your experience on tipeee.technical cookies are not configurable, but other cookies require your consent to be deposited.customize refuse allaccept all",0
How it works,0
Discover creators,0
Become a creator,0
Statistics,0
Search,0
Log in sign up,0
How it works,0
Discover creators,0
Become a creator,0
Statistics,0
Search,0
Tipeee's terms &amp.,0
Conditions derni re mise jour : 05/01/2020 pr ambule tous les termes et expressions d butant par une majuscule figurant ci-apr s sont d finis l article 1 des pr sentes conditions g n rales d utilisation.,0
"Les pr sentes conditions g n rales d utilisation, annexe incluse, (ci-apr s d nomm es cgu ) r gissent l ensemble des relations entre les utilisateurs du site tipeee.com et la soci t tipeee, soci t par actions simplifi e, au capital de 183 230 euros, inscrite au rcs de paris sous le num ro 529 108 334, dont le num ro de tva intracommunautaire est fr39529108334, dont le si ge social est situ au 20, rue du sentier -75002 paris france, dont l adresse e-mail est .",0
"Service.utilisateurs@tipeee.com, dont le num ro de t l phone est le 01 40 13 16 15, en cours d immatriculation sur le registre orias.",0
Le site a pour objectif de fournir un service permettant aux cr ateurs de contenus de cr er une relation privil gi e avec les internautes et de b n ficier de la part de ces derniers d'un soutien notamment financier la r alisation de leurs contenus.,0
Les visiteurs du site sont r put s accepter les cgu simplement par leur utilisation du site.,0
"Les membres sont r put s accepter les cgu la date d ouverture de leur compte de membre, tant pr cis que l'e-mail de bienvenue qu ils re oivent titre de confirmation de l'ouverture de ce compte inclut un lien permettant de t l charger les cgu.",0
"Les tipeurs sont r put s accepter les cgu en vigueur la date de leur tip, tant pr cis que l'e-mail de r capitulatif de commande qu ils re oivent titre de confirmation de leur tip inclut un lien permettant de t l charger les cgu en vigueur.",0
"Les cr ateurs de contenus sont r put s accepter les cgu en vigueur la date de r ception par leurs soins de l'e-mail envoy par tipeee leur confirmant que leur page tipeee va pouvoir commencer sa campagne de financement participatif sur le site, tant pr cis que cet e-mail de validation inclut un lien permettant de t l charger les cgu en vigueur.",0
"Il est par ailleurs express ment convenu que l acceptation des pr sentes cgu par l utilisateur inclut l acceptation par ce dernier des conditions g n rales d utilisation appliqu es par les prestataires de service assurant le bon fonctionnement des diff rents syst mes de paiement (ci-apr s d sign es ensemble les cgu de paiement ) propos s par le site, soit actuellement :",0
- pour le(s) syst me(s) de paiement propos s par adyen : les conditions g n rales d utilisation sont disponibles au lien suivant : https://www.adyen.com/legal/terms-and-conditions-adyen-for-platforms,0
"- pour le(s) syst me(s) de paiement propos s par paypal : les conditions g n rales d utilisation de paypal, lesquelles sont accessibles sur le site www.paypal.com",0
"- pour le(s) syst me(s) de paiement propos s par paysafecard : les conditions g n rales d utilisation de paysafecard, lesquelles sont accessibles sur le site www.paysafecard.com .",0
L utilisateur est par ailleurs inform que tipeee pourra modifier tout moment les pr sentes cgu.,1
"Lorsque les cgu seront ainsi modifi es, tous les membres recevront un e-mail d information incluant un lien permettant de t l charger ces nouvelles cgu.",1
Le membre ne pourra se connecter ensuite son compte de membre qu' la condition expresse qu'il accepte les nouvelles cgu en vigueur.,1
"Il est toutefois express ment pr cis que dans tous les cas, l acceptation des cgu par le membre, si ce membre est un tipeur ou un cr ateur de contenus pouvant tre consid r comme un consommateur au sens du code de la consommation, se fait sous r serve du droit de r traction dont il b n ficie en vertu des dispositions du code de la consommation.",0
Les informations relatives au droit de r tractation figurent l article 12 des pr sentes cgu.,0
"L utilisateur est galement express ment inform que tipeee n est en aucun cas responsable des pages tipeee, y compris en ce qui concerne la livraison ou non des contreparties.",0
"De m me, tipeee n est en aucun cas responsable des contenus, lesquels sont pr sent s et r alis s la seule initiative et sous la seule responsabilit des cr ateurs de contenus.",0
"A travers l utilisation du service, les utilisateurs sont amen s diffuser sur le site diff rents contenus et notamment des vid os, des images, des cr ations graphiques, de la musique, des textes, des id es et concepts, des logiciels, etc., ainsi que des marques ou brevets et l ments divers de propri t intellectuelle.",0
"Les utilisateurs sont avertis que l utilisation du site ne prot ge en rien ces contenus et qu il leur appartient, le cas ch ant, de prot ger ces contenus par ailleurs.",0
Les utilisateurs ne peuvent contribuer financi rement des contenus que s ils sont possesseurs de leur propre carte bancaire tablie leur nom.,0
Les utilisateurs ne peuvent proposer le financement de contenus sur le site que s ils sont g s au minimum de 16 ans.,0
Les pr sentes cgu constituent l int gralit des documents contractuels opposables entre tipeee et les utilisateurs.,0
"Par exception, pour le cas o le financement d un contenu n cessiterait la mise en place de modalit s sp cifiques, la soci t tipeee et les cr ateurs de contenus concern s pourront convenir par crit et au cas par cas de l application de conditions particuli res.",0
Les tipeurs concern s par ces conditions particuli res sont r put s accepter celles-ci la date de leur tip .,0
"Dans cette hypoth se, lesdites conditions particuli res seront envoy es aux tipeurs en m me temps que les cgu en vigueur galement sous la forme d un lien de t l chargement inclus dans l e-mail de r capitulatif de commande qu ils re oivent titre de confirmation de leur tip.",0
1.,0
"Definitions - par cgu , il convient d entendre les conditions g n rales d utilisation du service.",0
"- par commission , il convient d entendre la commission d un montant standard de 8% ttc soit 6,66% ht pr lev e aupr s du cr ateur de contenus par tipeee en contrepartie du service rendu.",0
"- par compte de membre , il convient d entendre le compte ouvert par un visiteur sur le site.",0
"- par contenu , il convient d entendre toute cr ation (vid o, article de blog, planche de bd, photo, etc.)",0
D un cr ateur de contenus dont la r alisation pourra tre financi rement soutenue par les tips des autres utilisateurs.,0
"- par contrepartie , il convient d entendre, s il y a lieu, la ou les contrepartie(s) ventuellement propos e(s) par le cr ateur de contenus aux tipeurs, en change de leurs tips.",0
"La ou les contrepartie(s) li e(s) aux contenus seront d finies au cas par cas sur le site, l enti re discr tion des cr ateurs de contenus.",0
"- par cr ateur de contenus , il convient d entendre un membre qui pr sente ses contenus sur une ou plusieurs pages tipeee.",0
"- par frais de transaction , il convient d entendre les frais en euros ttc acquitt s par le tipeur et s'ajoutant au montant de son tip au moment o celui-ci est pr lev .",0
"Ils repr sentent la somme du co t du prestataire de paiement en ligne, du co t du transfert d'argent et des frais de fonctionnement de tipeee (gestion des commandes, suivi des transactions, interface entre le prestataire, les banques et les tipeurs, maintenance du site internet, ).",0
"Ils sont calcul s de la fa on suivante en fonction du montant global de tips en fin de mois, ce montant tant ci-apr s d sign mgdt ) :",0
"* en cas de paiement par carte bancaire ou par d autres moyens de paiement disponibles sur le site et sp cifiques certains territoires (tels que, par exemple et sans que cette liste soit exhaustive, elv, sofort et giropay pour le territoire de l allemagne) :",0
"0,17 + 0,0045 x mgdt",0
* en cas de paiement par l interm diaire du service paypal :,0
"(i) 0,27 + 0,01 x mgdt si le mgdt est gal ou inf rieur 4 .",0
"(ii) 0,1 + 0,053 x mgdt si le mgdt est sup rieur 4 .",0
* en cas de paiement par l interm diaire du service paysafecard : aucun frais de transaction ne sera appliqu au tipeur.,0
"- par membre , il convient d entendre une personne physique ou morale inscrite sur le site et disposant d'un compte de membre.",0
Le membre peut devenir tipeur et/ou cr ateur de contenus.,0
"- par page tipeee , il convient d entendre la (les) page(s) du site cr e(s) par le cr ateur de contenus et d di e(s) ses contenus.",0
"- par publication d un contenu , il convient d entendre l activation par le cr ateur de contenus de la fonction int gr e sur sa page tipeee lui permettant, lorsqu il vient de mettre en ligne un nouveau contenu, d enclencher le processus de collecte des tips contenus correspondants.",0
"- par service , il convient d entendre le service propos par tipeee ayant pour objet de permettre :",0
* l'interm diation entre les cr ateurs de contenus et les tipeurs via le site .,0
* la collecte des tips par l'interm diation du site afin de permettre aux cr ateurs de contenus d obtenir un soutien financier la r alisation de leurs contenus .,0
* toute prestation compl mentaire en lien avec les services d crits ci-dessus.,0
"- par site , il convient d entendre le site internet : http://www.tipeee.com ou toute url qui pourrait lui tre substitu e par tipeee, ainsi que l ensemble des outils mis disposition par tipeee (widgets, api, etc.).",0
"- par tip , il convient d entendre un tip contenu et/ou un tip mensuel et/ou un tip unique.",0
"- par tipeur , il convient d entendre un membre ayant donn un tip ou un tip mensuel ou un tip unique au moins un cr ateur de contenus pr sent sur le site.",0
"- par tipeee , il convient d entendre la soci t tipeee, ainsi que tous ses associ s et/ou affili s.",0
"- par tip contenu , il convient d entendre la valeur mon taire hors frais de transaction que le tipeur s engage donner chaque publication d un contenu au cr ateurs de contenus.",0
"Par exemple, si le cr ateur de contenus cr e des vid os, que le tipeur s engage lui donner un tip contenu de 3 et que le cr ateur de contenus produit 4 nouvelles vid os dans le m me mois calendaire, le montant global donn par le tipeur sera gal 12 sur le mois calendaire consid r .",0
"- par tip mensuel , il convient d entendre la valeur mon taire hors frais de transaction que le tipeur s engage donner chaque mois un cr ateur de contenus, ind pendamment de toute publication de contenu.",0
"Dans cette hypoth se, il est pr cis que la valeur du tip mensuel se confond avec celle du tip plafond.",0
"Par exemple, sur un trimestre de r f rence, si le tipeur s engage donner au cr ateur de contenus un tip mensuel de 3 , que le cr ateur de contenus produit 2 nouvelles vid os dans le premier mois calendaire, aucune vid o le deuxi me mois calendaire et trois vid os le troisi me mois calendaire, le montant du tip mensuel sera gal 3 quel que soit le mois consid r dans le trimestre de r f rence et le montant global du tip mensuel sur ce trimestre de r f rence sera gal 9 .",0
"- par tip plafond , il convient d entendre le montant maximum par mois et par cr ateur de contenus que le tipeur peut d cider de donner au cr ateur de contenus consid r .",0
"Par exemple, si le cr ateur de contenus cr e des vid os, que le tipeur s engage lui donner un tip contenu de 3 avec un tip plafond de 18 et que le cr ateur de contenus produit 8 nouvelles vid os dans le m me mois calendaire, le montant global donn par le tipeur sera gal 18 (et non 24 ) sur le mois calendaire consid r .",0
"- par tip plancher , il convient d entendre le montant minimum d un tip, soit 1 .",0
"- par tip unique , il convient d entendre la valeur mon taire hors frais de transaction que le tipeur s engage donner imm diatement et une seule fois au cr ateur de contenus, ind pendamment de toute publication de contenu.",0
"Dans cette hypoth se, il est pr cis que la valeur du tip unique se confond avec celle du tip plafond et que l engagement du tipeur de soutenir le cr ateur de contenus prend fin d s que le tip unique consid r a t effectu .",0
"Par exemple, si le tipeur s engage donner au cr ateur de contenus un tip unique de 7 , le compte du tipeur sera d bit imm diatement et une seule et unique fois du montant de 7 et ce, que le cr ateur de contenus consid r publie ou non un nouveau contenu par la suite.",0
"- par utilisateur , il convient d entendre une personne physique ou morale acc dant au site et pouvant tre r partie dans les cat gories suivantes :",0
* visiteur .,0
* membre .,0
* tipeur .,0
* cr ateur de contenus.,0
"- par visiteur , il convient d entendre un internaute naviguant sur le site n ayant pas encore ouvert un compte de membre.",0
2.,0
Acces au site - ouverture et fermeture d un compte de membre l'acc s au site est gratuit et permet aux utilisateurs de consulter son contenu ditorial.,0
"L'acc s au site conf re aux utilisateurs un droit d'usage priv , non collectif et non exclusif, sur le contenu du site.",0
"Tipeee se r serve le droit, notamment pour des raisons de maintenance corrective ou volutive, de suspendre momentan ment l'acc s au site ou une partie de celui-ci.",0
Il est pr cis que tous mat riels ou logiciels n cessaires l'utilisation du service restent exclusivement la charge de l'utilisateur.,0
L'inscription en tant que membre donne acc s un compte de membre qui est unique et exclusivement accessible gr ce aux identifiants du membre.,0
"Le membre est seul responsable de l'utilisation qui est faite de ses identifiants, sans pouvoir opposer tipeee une quelconque perte, d tournement ou usage frauduleux par un tiers",1
Tout acc s et/ou utilisation du site et transmission de donn es effectu s partir d'un compte de membre seront r put s avoir t effectu s par le membre du compte concern .,0
"Nonobstant ce qui pr c de, le membre est tenu d'informer tipeee sans d lai de toute perte, d tournement ou usage frauduleux de ses identifiants par un tiers ayant permis l acc s son compte, en pr cisant ses nom, pr nom et nom d'utilisateur par courrier lectronique envoy l'adresse service.utilisateurs@tipeee.com ou par courrier postal l adresse du si ge social indiqu e en en-t te des pr sentes.",1
"Si le membre est un professionnel, il certifie d tenir l int gralit des droits n cessaires la conclusion des pr sentes au nom de la personne morale qu il repr sente (soci t , association, etc.).",0
"Si le membre souhaite cl turer son compte de membre, il devra se conformer la proc dure pr vue cet effet sur le site.",0
3.,0
"Conditions d'utilisation du site en qualit de membre le membre s'engage, sous peine de suspension imm diate et sans pr avis de son compte de membre :",0
"- ne pas cr er ou utiliser sur le site d'autres comptes que celui initialement cr et attribu , que ce soit sous sa propre identit ou celle d'un tiers .",0
- ne pas cr er une fausse identit de nature induire tipeee ou tout tiers en erreur et ne pas usurper l'identit d'une autre personne morale ou physique.,0
"Aux fins de s assurer du respect des dispositions des pr sentes, tipeee se r serve le droit de demander au membre de justifier par tout moyen de son identit .",0
"A d faut de justification dans un d lai de 7 (sept) jours compter de la demande de tipeee, la suspension voqu e au paragraphe pr c dent s appliquera.",0
"En acceptant ces cgu, le membre d clare que la source des fonds utilis s par lui sur le site n'est pas ill gale et s engage ne pas utiliser le site pour une activit ill gale ou frauduleuse, incluant (sans tre limitatif) le blanchiment d'argent.",0
Des poursuites civiles et/ou p nales peuvent tre intent es contre le membre et toutes autres personnes ayant directement ou indirectement particip une telle activit ill gale ou frauduleuse.,0
"Le membre est responsable de l acquittement de toute taxe applicable ou imp t associ , tant sur les sommes re ues en tant que cr ateur de contenus, que sur les tips donn s en tant que tipeur.",0
Tipeee ne saurait en aucun cas se substituer au membre cet effet ni m me le conseiller sur la nature et le d tail de ses obligations.,0
"Tipeee se r serve le droit de transmettre, sa discr tion, toute information susceptible d avoir un caract re ill gal ou frauduleux, aux autorit s comp tentes, sans en aviser le membre.",0
"A cette fin, tipeee se r serve le droit de s questrer tous les fonds dont elle soup onne de mani re l gitime qu ils sont li s une activit illicite ou frauduleuse, jusqu leur transmission l autorit comp tente.",0
"Le membre renonce tout droit ou recours, de quelle que nature que ce soit, qui pourrait lui tre reconnu ou ouvert, en quelque lieu que ce soit, raison de la communication par tipeee de ces informations aux autorit s comp tentes.",0
4.,0
Conditions d'utilisation du site en qualit de tipeur seuls les membres poss dant une carte bancaire tablie en leur nom propre sont autoris s effectuer des tips.,0
Les membres sont inform s du caract re al atoire li la cr ation de tout nouveau contenu et acceptent express ment la part d incertitude li e la r alisation de ces contenus.,0
Les tips effectu s par les tipeurs au profit d un ou plusieurs cr ateurs de contenus s op rent au moyen des services de paiement propos s par le site.,0
Les tips contenus sont d bit s autour du 6 du mois suivant le mois au cours duquel au moins une publication de contenu est intervenue.,0
"Les tips mensuels seront d bit s chaque mois, le premier pr l vement tant effectu autour du 6 du mois suivant celui au cours duquel les tipeurs concern s auront opt pour le tip mensuel.",0
Les tips uniques seront d bit s imm diatement.,0
Le montant minimum du tip sera gal au tip plancher tel que d fini l article 1 des cgu.,0
"Le tipeur pourra annuler son tip, ou en modifier le montant, tout moment .",0
"De m me, le tipeur pourra annuler ou instaurer ou modifier son tip plafond tout moment.",0
"Par exception ce qui pr c de : - le tip unique tant d bit imm diat, celui-ci ne pourra faire l objet d aucune annulation ou modification de montant .",0
"- lorsque le cr ateur de contenu aura proc d la publication d un contenu, les tips contenus correspondants audit contenu lui seront d finitivement acquis.",0
La publication d un contenu sera suivie de l envoi automatique aux tipeurs d un courrier lectronique leur communiquant le(s) lien(s) hypertexte permettant d acc der au(x) nouveau(x) contenu(s) correspondant(s).,0
Il est express ment pr cis que (i) les modifications et/ou annulations de tip et/ou de tip plafond n ont pas d effet r troactif et (ii) la d cision du tipeur de modifier son tip et/ou de modifier son tip plafond constitue un nouvel engagement de don enti rement distinct du pr c dent.,0
"A titre d exemple, si le tipeur d cide le 16 du mois calendaire consid r de faire passer son tip contenu de 2 4 et son tip plafond de 8 10 , que deux publications de contenus sont intervenues avant cette date et trois publications apr s cette date, le tipeur sera pr lev de 14 sur l ensemble du mois consid r , soit l addition des deux montants suivants :",0
- 4 pour la p riode courant du 1er au 15 du mois calendaire consid r .,0
- 10 pour la p riode courant du 16 la fin du mois calendaire consid r .,0
"Tipeee ne pr l ve pas de commission aupr s des tipeurs, mais seulement aupr s des cr ateurs de contenus.",0
"Toutefois, lors du pr l vement du tip, tipeee facturera des frais de transaction qui seront clairement indiqu s au tipeur avant le pr l vement effectif du tip.",0
Le tipeur est inform et accepte sans r serve qu en aucun cas ces frais ne pourront faire l objet d un remboursement.,0
Lorsqu un cr ateur de contenus cr sa page tipeee celui-ci doit n cessairement opter :,0
"- soit pour un soutien financier li la publication d un contenu,",0
- soit pour un soutien financier ind pendant de toute publication de contenu.,0
"Par cons quent, le tipeur pourra uniquement effectuer :",0
"- des tips contenus si le cr ateur de contenus concern a opt pour un soutien financier li la publication d un contenu,",0
- des tips mensuels si le cr ateur de contenus concern a opt pour un soutien financier ind pendant de toute publication d un contenu.,0
"En revanche, le tipeur pourra effectuer des tips uniques quel que soit l option de soutien choisie par le cr ateur.",0
"Le tipeur reconna t et accepte express ment que le cr ateur de contenus qu il soutient se verra communiquer par tipeee les informations sur son identit ainsi que ses adresses lectronique et postale, afin notamment de permettre au cr ateur de contenus de communiquer avec lui par courrier lectronique et lui envoyer le cas ch ant les contreparties promises.",0
5.,0
Conditions d'utilisation du site en qualit de createur de contenus l utilisation du site par un membre en tant que cr ateur de contenus est conditionn e l approbation pr alable et crite de tipeee.,0
Cette approbation se fera sur la base des bonnes pratiques de cr ation d une page tipeee telles qu elles sont pr sent es sur le site mais ne garantit en rien le tipeur sur la r alisation de nouveaux contenus par le cr ateur de contenus ou l authenticit des informations pr sent es par ce dernier.,0
"Lorsqu un cr ateur de contenus cr sa page tipeee, celui-ci doit n cessairement opter :",0
"- soit pour un soutien financier li la publication d un contenu, auquel cas le cr ateur de contenus ne pourra collecter que des tips contenus,",0
"- soit pour un soutien financier ind pendant de toute publication de contenu, auquel cas le cr ateur de contenus ne pourra collecter que des tips mensuels.",0
"Quelle que soit l option de soutien retenue, le cr ateur de contenus pourra en revanche recevoir des tips uniques.",0
"Lorsque le cr ateur de contenus aura mis en ligne un nouveau contenu et qu il souhaitera collecter les tips contenus correspondants, celui-ci devra proc der la publication d un contenu sur sa page tipeee.",0
"Les tips contenus, minor s des ventuels impay s et de la commission de tipeee, seront alors vers s au cr ateur de contenus par tipeee le dernier jour ouvr du mois de survenance de la publication de contenu consid r e, sous r serve (i) de l absence de r clamation des tipeurs concern s portant soit sur le caract re abusif du nouveau contenu, soit sur la non-conformit de ce nouveau contenu aux promesses faites par le cr ateur de contenus et (ii) de l coulement du d lai de r traction du droit de r traction pr vu au b n fice des tipeurs par le code de la consommation.",0
"Les tips mensuels et/ou les tips uniques, minor s des ventuels impay s et de la commission de tipeee, seront vers s au cr ateur de contenus par tipeee le dernier jour ouvr de chaque mois, sous r serve (i) de l absence de r clamation des tipeurs concern s portant soit sur le caract re abusif d un nouveau contenu, soit sur la non-conformit d un nouveau contenu aux promesses faites par le cr ateur de contenus et (ii) de l coulement du d lai de r traction du droit de r traction pr vu au b n fice des tipeurs par le code de la consommation.",0
"Les sommes correspondant au montant total des tips dus, d duction faite de la commission revenant tipeee, seront vir es sur le compte bancaire du cr ateur de contenus, lequel devra ce titre fournir tipeee un relev d identit bancaire (rib).",0
"Auparavant, les tips seront indisponibles.",0
Il est pr cis qu en cas d utilisation du syst me de paiement propos par paysafecard :,0
"- il sera d duit du montant des tips revenant au cr ateur de contenus, en plus de la commission de tipeee, des frais de transaction mon taires hauteur de 15% (quinze pour cent) du montant de chaque tip",0
- le cr ateur de contenus ne pourra recevoir que des tips uniques et pas de tips mensuels.,0
"Il est pr cis qu en cas d utilisation du syst me de paiement propos par paypal qu il sera d duit du montant des tips revenant au cr ateur de contenus, en plus de la commission de tipeee, des frais de transaction mon taires hauteur 1 % (un pour cent) du montant de chaque tip, ces frais tant plafonn s 6 (six) euros par tip.",0
Le cr ateur de contenus reconna t et accepte express ment que tipeee communiquera premi re demande son identit ainsi que ses coordonn es aux tipeurs d s lors que leurs tips lui seront d finitivement acquis.,0
5.1.,0
Engagements du cr ateur de contenus,0
Le cr ateur de contenus s engage fournir de mani re claire et pr cise sur sa (ses) page(s)tipeee :,0
- la description de son activit de cr ateur .,0
- le type de contenus qu il cr e et le rythme auquel il produit ces contenus .,0
- les contreparties qu il propose.,0
Le cr ateur de contenus d clare avoir conserv sur tout support de son choix l'original de tous les l ments qu'il pourrait mettre en ligne.,0
"Quel que soit le nombre de personnes impliqu es dans la cr ation des contenus, il ne peut y avoir qu un seul cr ateur de contenus par page tipeee.",0
Le cr ateur de projet devra ainsi tre individuellement et clairement identifi .,0
Il sera seul b n ficiaire des droits et responsable des obligations attach es au compte de membre et la page qu il aura cr e en tant que cr ateur de contenus sur le site.,0
"Le cr ateur de contenus devra, au pr alable du versement de son premier tip, soumettre son compte de membre la proc dure de certification d crite ci-apr s afin de pouvoir disposer des fonds auxquels il a droit.",0
La proc dure de certification consistera pour le cr ateur de contenus envoyer tipeee une pi ce d identit attestant de l authenticit de l identit qu il aura initialement d clar e sur le site.,0
"Le cr ateur de contenus pourra tout moment mettre fin sa (ses) page(s) tipeee, sous r serve de s tre acquitt de toutes ses obligations vis- -vis des tipeurs, notamment de son obligation de livraison des contreparties promises.",0
