text,highlighted
Terms of service,0
Last updated: 2020/12/02,1
1.,0
Terms,0
"By signing up to the the website at https://tryhackme.com, you are",0
"Agreeing to be bound by these terms of service, all applicable laws and regulations, and agree that you are",0
Responsible for compliance with any applicable local laws.,0
"If you do not agree with any of these terms, you",0
Are prohibited from using or accessing this site.,0
The materials contained in this website are protected by,0
Applicable copyright and trademark law.,0
2.,0
Use license,0
"Unless explicity stated or credited, users are assumed to own the material they used to create a room.",0
Users without subscriptions can only access non-subscription rooms.,0
This license shall automatically terminate if you violate any of these restrictions and may be,0
Terminated by tryhackme at any time.,0
Upon terminating your viewing of these materials or upon the,0
"Termination of this license, you must destroy any downloaded materials in your possession whether in",0
Electronic or printed format.,0
3.,0
Disclaimer,0
The materials on tryhackme's website are provided on an 'as is' basis.,1
"Tryhackme makes no warranties,",0
"Expressed or implied, and hereby disclaims and negates all other warranties including, without limitation,",0
"Implied warranties or conditions of merchantability, fitness for a particular purpose, or non-infringement",0
Of intellectual property or other violation of rights.,0
"Further, tryhackme does not warrant or make any representations concerning the accuracy, likely results,",1
Or reliability of the use of the materials on its website or otherwise relating to such materials or on,1
Any sites linked to this site.,1
4.,0
Limitations,0
"In no event shall tryhackme or its suppliers be liable for any damages (including, without limitation,",0
"Damages for loss of data or profit, or due to business interruption) arising out of the use or inability to",0
"Use the materials on tryhackme's website, even if tryhackme or a tryhackme authorized representative has",0
Been notified orally or in writing of the possibility of such damage.,0
Because some jurisdictions do not,0
"Allow limitations on implied warranties, or limitations of liability for consequential or incidental",0
"Damages, these limitations may not apply to you.",0
5.,0
Accuracy of materials,0
"The materials appearing on tryhackme's website could include technical, typographical, or photographic",0
Errors.,0
"Tryhackme does not warrant that any of the materials on its website are accurate, complete or",0
Current.,0
Tryhackme may make changes to the materials contained on its website at any time without notice.,0
However tryhackme does not make any commitment to update the materials.,0
6.,0
Links,0
Tryhackme has not reviewed all of the sites linked to its website and is not responsible for the contents,0
Of any such linked site.,0
The inclusion of any link does not imply endorsement by tryhackme of the site.,0
Use,0
Of any such linked website is at the user's own risk.,0
7.,0
Modifications,0
Tryhackme may revise these terms of service for its website at any time without notice.,1
By using this,0
Website you are agreeing to be bound by the then current version of these terms of service.,0
8.,0
Governing law,0
"These terms and conditions are governed by and construed in accordance with the laws of london, united",1
Kingdom and you irrevocably submit to the exclusive jurisdiction of the courts in that state or location.,1
9.,0
User code of conduct,0
"Tryhackme reserves the right to discontinue service for any user that violates these terms and conditions,",1
And the user conduct,1
We expect users to follow certain conditions including but not limited to:,0
Users must only attack infrastructure/material provided by a room they join.,0
Users must not distribute any malicious material to other user such as malware through the upload,0
"Functionality, or through any other means.",0
"User must abstain from any unlawful, inappropriate and abusive use of the content and the services",0
"Provided on this website at all times, in accordance with the existing legislation, and respect the",0
Intellectual property rights of tryhackme.,0
10.,0
Payments all payments on tryhackme are by third-party api's.,0
We do not store any personal payment details on the,0
Site (apart from the payment method).,0
By paying with 'stripe.com' you agree to their terms and conditions.,0
We only offer refunds on payments to this website via stripe.,0
We reserve the right to offer a refund.,1
All,0
Payments are final,0
We hold the right to close any account (without any form of refunds) at our discretion.,1
Privacy policy,0
Your privacy is important to us.,0
It is tryhackme's policy to respect your privacy regarding any information,0
"We may collect from you across our website, https://tryhackme.com, and",0
Other sites we own and operate.,0
Tryhackme adheres to gdpr(general data protection regulation) and are gdpr compliant when collecting and,1
Processing user information.,1
What data do we collect,0
We collect the following information,0
Full name,0
Username,0
Email,0
Password,0
Gender,0
Occupation information including job title and place of work,0
Feedback about user experience,0
Usage statistics on the platform.,0
Examples of these statistics include most accessed room and number of deployments,0
Some of these statics are sent to the third party analytics service: amplitude,1
Log data when you visit our website.,0
"This log data may include information such as your computer's ip address, browser page, pages of service you visit, your time spent there and other statistics.",0
Session recordings using hotjar.,0
These captures do not include any of the aformentioned personally identifiable information,0
How do we collect your data,0
We collect the aformentioned information on the sign up and profile pages of the website.,0
"We also collect feedback through the feedback section on the website, sending out forms via email, and focus groups and interviews with users.",0
Other information such as logging and usage statistics are gathered automatically when a user accesses features of tryhackme.,0
What do we use your data for,1
We use the information entered in the profile to help assess how to create appropriate content for the,1
Users.,1
"Depending on the users occupation and skill levels, we aim to create content the better suits their",1
Needs.,1
"When running specific events using tryhackme such as ctfs, users who sign up to such events on the",1
Platform are explicity notified that their information is used by organizing parties involved in the event.,1
"The gathering,",1
Processing and use of the data follows the aformentioned processes.,1
"By default, users opt-in to receiving emails from tryhackme, and this can be changed upon specific request",0
From the users how do we store your data,0
"Tryhackme will take reasonable technical and organisational precautions to prevent the loss, misuse or",0
Alteration of your personal information.,0
Tryhackme will store all the personal information you provide on,0
Its secure servers.,0
Information relating to electronic transactions entered into via this website will be,0
Protected by encryption technology.,0
We only retain collected information for as long as necessary to provide you with your requested service.,0
"What data we store, we ll protect within commercially acceptable means to prevent loss and theft, as well as",0
"Unauthorised access, disclosure, copying, use or modification.",0
Our website may link to external sites that are not operated by us.,0
Please be aware that we have no control,0
"Over the content and practices of these sites, and cannot accept responsibility or liability for their",0
Respective privacy policies.,0
"You are free to refuse our request for your personal information, with the understanding that we may be",0
Unable to provide you with some of your desired services such as creating more appropriate virtual rooms and,0
Other training content.,0
Your continued use of our website will be regarded as acceptance of our practices around privacy and,0
Personal information.,0
"If you have any questions about how we handle user data and personal information, feel",0
Free to contact us,0
What are your data protection rights,0
You have the following rights with respect to your data:,0
The right to access: you have the right to request tryhackme for copies of your personal data.,1
We may,1
Charge you a small fees for this service,1
The right to rectification: you have the right to request that tryhackme correct any information you,1
Believe is inaccurate.,1
You also have the right to request our comapny to complete the information you,1
Believe is incomplete,1
The right to erasure: you have the right to request that tryhackme erase your personal data under,0
Certain conditions,0
The right to restrict processing: you have the right to request that tryhackme restrict the processing,0
"Of your personal data, under certain conditions",0
The right to object to processing: you have the right to object to tryhackme processing your personal,0
"Data, under certain conditions",0
The right to data portability: you have the right to request that tryhackme transfer that data that we,0
"Have collected to another organization, or directly to you, under certain conditions",0
"If you make a request, we have one month to respond to you.",0
If you would like to exercise any of these,0
"Rights, please contact us at our email: hello@tryhackme.com",0
This policy is effective as of 10 october 2018.,0
Cookie policy,0
About cookies,0
This website uses cookies.,0
"By using this website and agreeing to this policy, you consent to tryhackme's",0
Use of cookies in accordance with the terms of this policy.,0
Cookies are files sent by web servers to web,0
"Browsers, and stored by the web browsers.",0
The information is then sent back to the server each time the,0
Browser requests a page from the server.,0
This enables a web server to identify and track web browsers.,0
There,0
Are two main kinds of cookies: session cookies and persistent cookies.,0
Session cookies are deleted from your,0
"Computer when you close your browser, whereas persistent cookies remain stored on your computer until",0
"Deleted, or until they reach their expiry date.",0
Google cookies,0
Tryhackme uses google analytics to analyse the use of this website.,0
Google analytics generates statistical,0
"And other information about website use by means of cookies, which are stored on users' computers.",0
The,0
Information generated relating to our website is used to create reports about the use of the website.,0
Google,0
Will store and use this information.,0
Google's privacy policy is available at:,0
Https://www.google.com/privacypolicy.html.,0
Tryhackme publishes google adsense interest-based advertisements on this website.,0
These are tailored by,0
Google to reflect your interests.,0
"To determine your interests,",0
Google will track your behaviour across the,1
Web using cookies,1
"You can view, delete or add interest categories associated with your browser using",0
"Google's ads preference manager, available at: https://www.google.com/ads/preferences/.",0
You can opt-out of,0
The adsense partner network cookie at: https://www.google.com/privacy_ads.html.,0
"However, this opt-out",0
"Mechanism uses a cookie, and if you clear the cookies from your browser your opt-out will not be maintained.",0
"To ensure that an opt-out is maintained in respect of a particular browser, you should use the google",0
Browser plug-in available at: https://www.google.com/ads/preferences/plugin.,0
Hotjar cookies,0
"As mentioned above, we use hotjar to ensure that we can enhance users' experience by understanding how",0
Exactly they interact with the user interface.,0
Hotjar does not record any personally identifiable,0
Information.,0
Hotjar operates by tracking users using its cookies.,0
Tryhackme only uses this information,1
"Internally and does not send, distribute or sell this data to any other third party, apart from hotjar(where",1
This data is stored).,1
